innings,Over,Commentary,active_partnership,reviews,Review_team,Review_batsman,Review_umpire,Review_outcome,Umpires_call,index,Partnership_broken,match,innings_action,overturned,review_lost,first_review_lost,second_review_lost,overturned_decisions,ratio_overturned,team,bowler
Australia 2nd innings,25.1,"Woakes to Labuschagne, no run, it nipped back in sharply off the deck, Labuschagne was squared up totally, it beats his edge and strikes him on the pads. The umpire was not interested, Root took the matter upstairs but was proved wrong as the impact was outside off",4,"Over 25.1: Review by England (Bowling), Umpire - Aleem Dar, Batsman - M Labuschagne (Struck down)",England (Bowling),M Labuschagne,Aleem Dar,Struck down,False,4.0,False,eng-vs-aus-2nd-test-the-ashes-2019,Bowling,False,True,True,False,2,0.15384615384615385,England,Woakes
England 2nd innings,40.1,"Hazlewood to Stokes, no run, a desperate review from Australia. Took it with just a second left. There was no excitement when the appeal was made for some of them suspected an inside edge and inside edge it was. Stokes shuffled down the pitch and eked out a fine edge onto his pad before falling across on the on-drive. Paine had a long chat with his bowler and went up for it almost reluctantly",5,"Over 40.1: Review by Australia (Bowling), Umpire - CB Gaffaney, Batsman - BA Stokes (Struck down)",Australia (Bowling),BA Stokes,CB Gaffaney,Struck down,False,2.0,False,eng-vs-aus-2nd-test-the-ashes-2019,Bowling,False,True,True,False,2,0.15384615384615385,Australia,Hazlewood
Australia 1st innings,72.3,"Jofra Archer to Pat Cummins, no run, England review: Fair delivery and it's missed everything. Nothing on the UltraEdge either. The onfield verdict will stay. A fiery bumper outside off, forces Cummins into a tangle on the hop as he tries to fend that, escapes past the elbow guard and carries to the keeper. There was some sound as the ball passed the bat, but there was no contact. Absolutely nothing. England felt they had him and went up for the review straightaway...",7,"Over 72.3: Review by England (Bowling), Umpire - Aleem Dar, Batsman - PJ Cummins (Struck down)",England (Bowling),PJ Cummins,Aleem Dar,Struck down,False,10.0,False,eng-vs-aus-2nd-test-the-ashes-2019,Bowling,False,True,True,False,2,0.15384615384615385,England,Jofra Archer
Australia 1st innings,72.3,"Jofra Archer to Pat Cummins, no ball, Jofra Archer's overstepped! Full delivery on off and Cummins blocks it into the off-side",7,"Over 72.3: Review by England (Bowling), Umpire - Aleem Dar, Batsman - PJ Cummins (Struck down)",England (Bowling),PJ Cummins,Aleem Dar,Struck down,False,10.0,False,eng-vs-aus-2nd-test-the-ashes-2019,Bowling,False,True,False,True,2,0.15384615384615385,England,Jofra Archer
England 1st innings,57.5,"Smith to Bairstow, no run, this looks like another waste of a review from Australia. Yes, well wide of the stumps. Bairstow shoulders arms to a slider which brushes his front pad on the way through. It has Paine and Smith excited, but it's not coming back enough",7,"Over 57.5: Review by Australia (Bowling), Umpire - CB Gaffaney, Batsman - JM Bairstow (Struck down)",Australia (Bowling),JM Bairstow,CB Gaffaney,Struck down,False,5.0,False,eng-vs-aus-2nd-test-the-ashes-2019,Bowling,False,True,False,True,2,0.15384615384615385,Australia,Smith
England 1st innings,15.6,"Lyon to Denly, no run, never looked out did it? Missing by a fair distance down the leg-side. It was on pitched on a slightly fuller length and Denly wasn't fully forward to it, tries to work it with the spin and gets beaten on the inside edge. The appeal wasn't strong but Lyon had a chat with his skipper and the latter went up straightaway....",3,"Over 15.6: Review by Australia (Bowling), Umpire - CB Gaffaney, Batsman - JL Denly (Struck down)",Australia (Bowling),JL Denly,CB Gaffaney,Struck down,False,0.0,False,eng-vs-aus-2nd-test-the-ashes-2019,Bowling,False,True,True,False,2,0.15384615384615385,Australia,Lyon
England 2nd innings,44.4,"Siddle to Moeen Ali, no run, Australia have lost one review. The ball decks in sharply and beats Ali on the inside edge, the ball hit him above the kneeroll and the height was always going to be the issue. Ball-tracking confirmed it was, umpire Wilson getting a few back now",8,"Over 44.4: Review by Australia (Bowling), Umpire - JS Wilson, Batsman - MM Ali (Struck down)",Australia (Bowling),MM Ali,JS Wilson,Struck down,False,18.0,False,eng-vs-aus-1st-test-the-ashes-2019,Bowling,False,True,True,False,10,0.5,Australia,Siddle
Australia 2nd innings,97.6,"Moeen Ali to Paine, no run, review time. England clearly have good reason to challenge umpire Dar's possible sixth blunder in this game -- but no, he'll stay on five for now. So Paine wasn't playing a shot to an in-spinning delivery from outside off, kicking it away with his right pad that was very deep in his crease. Sure there was big turn, but apparently not enough, missing off by a couple of inches",6,"Over 97.6: Review by England (Bowling), Umpire - Aleem Dar, Batsman - TD Paine (Struck down)",England (Bowling),TD Paine,Aleem Dar,Struck down,False,13.0,False,eng-vs-aus-1st-test-the-ashes-2019,Bowling,False,True,False,True,10,0.5,England,Moeen Ali
Australia 2nd innings,74.5,"Moeen Ali to Smith, no run, appeal. And England will take matters upstairs. It's Smith after all, and it's umpire Wilson after all. So Ali's gotten this one to spin in past Smith's forward defence -- but alas, HawkEye tells us there's a little too much of it, heading easily down leg",5,"Over 74.5: Review by England (Bowling), Umpire - JS Wilson, Batsman - SPD Smith (Struck down)",England (Bowling),SPD Smith,JS Wilson,Struck down,False,6.0,False,eng-vs-aus-1st-test-the-ashes-2019,Bowling,False,True,True,False,10,0.5,England,Moeen Ali
England 1st innings,82.2,"Pattinson to Rory Burns, no run, big LBW ask -- And the Aussies ain't trusting these umpires any longer. They go up when it isn't given .. and it's pitching comfortably down leg. Ah, redemption, ump Wilson! Burns is trapped in the crease, but this over the wicket angle is always going to be dodgy",5,"Over 82.2: Review by Australia (Bowling), Umpire - JS Wilson, Batsman - RJ Burns (Struck down)",Australia (Bowling),RJ Burns,JS Wilson,Struck down,False,9.0,False,eng-vs-aus-1st-test-the-ashes-2019,Bowling,False,True,True,False,10,0.5,Australia,Pattinson
Australia 1st innings,74.2,"Broad to Smith, no run, England's LBW review. So Smith shuffles as usual, looks to whip this full one through mid-wicket, but the ball drifts in more than he'd anticipated to pin him on the front pad. And when there's a review about to be wasted, why not officially waste it -- Root takes it upstairs, and it's easily down leg",10,"Over 74.2: Review by England (Bowling), Umpire - JS Wilson, Batsman - NM Lyon (Struck down)",England (Bowling),NM Lyon,JS Wilson,Struck down,False,19.0,False,eng-vs-aus-1st-test-the-ashes-2019,Bowling,False,True,False,True,10,0.5,England,Broad
Australia 1st innings,3.1,"Broad to Warner, no run, England take a review against Warner! They're not excited though, as it could probably be umpire's call. Broad had his hands on the head but this might go in favor of the batsman as he's standing way outside his crease. It's missing, in fact. Warner looked to defend this one off his toes but got beaten for pace. The impact was in line but the ball was sailing over the stumps. Umpire's decision stays as it is and England have lost one review",1,"Over 3.1: Review by England (Bowling), Umpire - Aleem Dar, Batsman - DA Warner (Struck down)",England (Bowling),DA Warner,Aleem Dar,Struck down,False,0.0,False,eng-vs-aus-1st-test-the-ashes-2019,Bowling,False,True,True,False,10,0.5,England,Broad
Pakistan 2nd innings,11.2,"Hazlewood to Masood, no run, Paine thinks there is an edge and he has gone for a review.  Bat seems to have come down after the ball has passed and it looks like an another ordinary review from Tim Paine and Australia. Nothing on the hotSpot and on-field decision will stay. Australia lose a review.  It was drifting down the leg-side, Masood was late on the flick. It clips his thigh pad and ends up into the gloves of Paine. The slip cordon advised Paine to take the review, which he did and he was proved wrong within minutes",4,"Over 11.2: Review by Australia (Bowling), Umpire - RK Illingworth, Batsman - Shan Masood (Struck down)",Australia (Bowling),Shan Masood,RK Illingworth,Struck down,False,2.0,False,aus-vs-pak-2nd-test-pakistan-tour-of-australia-2019,Bowling,False,True,True,False,1,0.125,Australia,Hazlewood
Pakistan 1st innings,33.1,"Starc to Yasir Shah, no run, it's referred by Paine! Yasir Shah might have nicked this down the leg-side. 139.9km/h. Hotspot on the trouser, nothing on the bat. Nothing on Snicko either. And that's not out. Both reviews gone for the Aussies.",7,"Over 33.1: Review by Australia (Bowling), Umpire - MA Gough, Batsman - Yasir Shah (Struck down)",Australia (Bowling),Yasir Shah,MA Gough,Struck down,False,6.0,False,aus-vs-pak-2nd-test-pakistan-tour-of-australia-2019,Bowling,False,True,False,True,1,0.125,Australia,Starc
Pakistan 1st innings,1.1,"Pat Cummins to Imam, no run, 135.3kph, good length delivery, Imam-ul-Haq looks to play across the line and misses it. Wears it on the pad and Australia went up in unison for an lbw appeal. The Australians after a big conversation decided to go upstairs. Pitched outside leg and Australia have burnt a review in the second over",1,"Over 1.1: Review by Australia (Bowling), Umpire - MA Gough, Batsman - Imam-ul-Haq (Struck down)",Australia (Bowling),Imam-ul-Haq,MA Gough,Struck down,False,4.0,False,aus-vs-pak-2nd-test-pakistan-tour-of-australia-2019,Bowling,False,True,True,False,1,0.125,Australia,Pat Cummins
Australia 1st innings,111.4,"Shaheen Afridi to Wade, no run, Pakistan have gone for a caught behind review.  This looks close. There was some sound for sure but was it off bat hitting the pad? There is a flat line on the snicko and the original decision will stay.  Pakistan have lost both their reviews now. It was a length delivery around off, it straightens off the deck, Wade ends up playing inside the line. It defeats his outside edge and goes into the gloves of Rizwan. Pakistan challenged the umpire's decision but they were proved wrong withion minutes",1,"Over 111.4: Review by Pakistan (Bowling), Umpire - RK Illingworth, Batsman - MS Wade (Struck down)",Pakistan (Bowling),MS Wade,RK Illingworth,Struck down,False,3.0,False,aus-vs-pak-2nd-test-pakistan-tour-of-australia-2019,Bowling,False,True,False,True,1,0.125,Pakistan,Shaheen Afridi
Australia 1st innings,66.4,"Yasir Shah to Warner, 1 run, Pakistan have gone for a lbw review. Warner attempts the sweep on this delivery which was very full, doesn't connect it as he would have liked. But got an inside edge and that saved him. Pakistan are desperate for a wicket so they went upstairs but there optimism couldn't buy them a wicket as there was a clear inside edge!",2,"Over 66.4: Review by Pakistan (Bowling), Umpire - MA Gough, Batsman - DA Warner (Struck down)",Pakistan (Bowling),DA Warner,MA Gough,Struck down,False,0.0,False,aus-vs-pak-2nd-test-pakistan-tour-of-australia-2019,Bowling,False,True,True,False,1,0.125,Pakistan,Yasir Shah
Australia 1st innings,75.4,"Haris Sohail to Warner, no run, turning down leg, terrible delivery and Warner went for the sweep and missed it. The keeper realized late that there was a little sound as the ball went past the bat and appealed. The skipper also decided to review it. The replays don't seem to show an edge so Warner should survive this. Snicko shows a line as flat as a pool table. Review lost. Poor one indeed from Pakistan to have taken that review",2,"Over 75.4: Review by Pakistan (Bowling), Umpire - RK Illingworth, Batsman - DA Warner (Struck down)",Pakistan (Bowling),DA Warner,RK Illingworth,Struck down,False,1.0,False,aus-vs-pak-1st-test-pakistan-tour-of-australia-2019,Bowling,False,True,True,False,2,0.2857142857142857,Pakistan,Haris Sohail
West Indies 1st innings,29.1,"Bumrah to Darren Bravo, out Lbw!! 50th Test wicket for Jasprit Bumrah. He was the most economical bowler for India thus far and the reward was always coming. Went wide of the crease and angled it into the left-hander, Bravo tries to shuffle across on the flick and gets caught in the crease. It pins him just below the knee roll and umpire Richard Kettleborough puts his finger up after a brief deliberation. Hitting the top of leg peg. Windies lose a review. Darren Bravo lbw b Bumrah 18(27) [4s-2 6s-1]",4,"Over 29.1: Review by West Indies (Batting), Umpire - RA Kettleborough, Batsman - DM Bravo (Struck down)",West Indies (Batting),DM Bravo,RA Kettleborough,Struck down,False,1.0,True,wi-vs-ind-1st-test-india-tour-of-west-indies-2019,Batting,False,True,True,False,4,0.36363636363636365,West Indies,Bumrah
Sri Lanka 2nd innings,43.5,"Southee to Karunaratne, out Lbw!! Karunaratne has been given lbw as he hasn't offered a shot. The skipper decides to challenge the onfield call, but to no avail. A brain fade for the captain and Southee is the beneficiary - achieves the feat of 250 Test wickets. Has been a memorable Test for both - Southee and Boult. They've got to the 250-wicket mark in the same match. This was speared into the batsman from round the wicket and the left hander didn't offer a shot, keeping his bat behind the pads, was a touch late to play it. Though the impact was well outside off, it had enough movement to shape in and rock the off-stump. Indecision, dilemma - the cause behind his downfall. Just the wicket the Kiwis were looking for. They can now possibly trigger a batting collapse, possibly. Karunaratne lbw b Southee 21(70) [4s-2]",6,"Over 43.5: Review by Sri Lanka (Batting), Umpire - BNJ Oxenford, Batsman - FDM Karunaratne (Struck down)",Sri Lanka (Batting),FDM Karunaratne,BNJ Oxenford,Struck down,False,5.0,True,sl-vs-nz-2nd-test-new-zealand-tour-of-sri-lanka-2019,Batting,False,True,True,False,1,0.2,Sri Lanka,Southee
Sri Lanka 1st innings,85.1,"Southee to Lasith Embuldeniya, out Lbw!! Embuldeniya has been adjudged lbw and he's decided to challenge the call. Looks very close, probably hitting the leg stump. It's hitting middle and leg. And the onfield decision stays. A fine delivery by Southee, this. Pitches on middle and jags in ever so slightly, the batsman gets beaten due to the movement and is pinned right in front of the middle stump. Replays confirm three reds and the batsman will have to make his way back to the pavilion. Tim needs only a wicket more to complete his 5-for. Can he do it? Lasith Embuldeniya lbw b Southee 0(2)",9,"Over 85.1: Review by Sri Lanka (Batting), Umpire - MA Gough, Batsman - L Embuldeniya (Struck down)",Sri Lanka (Batting),L Embuldeniya,MA Gough,Struck down,False,3.0,True,sl-vs-nz-2nd-test-new-zealand-tour-of-sri-lanka-2019,Batting,False,True,True,False,1,0.2,Sri Lanka,Southee
New Zealand 2nd innings,105.6,"Dhananjaya de Silva to Ajaz Patel, out Lbw!! That looked straight and Ajaz has been given OUT LBW. With a review on offer, he decides to take a chance. Hold on, is it a no-ball? 'Very tight', says Bruce Oxenford. On second view, he deems it as a fair delivery. Clearly no bat, ball-tracking coming up. Three REDS and it will stay OUT. Sri Lanka need 268 to win. The frustration is finally over for the hosts - this was tossed up outside off and spun back in, stayed a bit low and struck Ajaz right in front of off, was going on and crashing into the middle-stump. Ajaz Patel lbw b Dhananjaya de Silva 14(23) [4s-1]",10,"Over 105.6: Review by New Zealand (Batting), Umpire - MA Gough, Batsman - AY Patel (Struck down)",New Zealand (Batting),AY Patel,MA Gough,Struck down,False,13.0,True,sl-vs-nz-1st-test-new-zealand-tour-of-sri-lanka-2019,Batting,False,True,True,False,4,0.2857142857142857,New Zealand,Dhananjaya de Silva
Sri Lanka 1st innings,93.2,"Somerville to Lasith Embuldeniya, out Lbw!! That looked plumb right through. But Embuldeniya just wanted to take a chance. The slider that drifts in with the round the wicket angle, Embuldeniya kneels down to play the sweep and misses it, beaten for pace and struck on the back thigh. The impact was in-line and it was going on to smash middle-stump. Somerville finishes with three wickets. Lasith Embuldeniya lbw b Somerville 5(17) [4s-1]",10,"Over 93.2: Review by Sri Lanka (Batting), Umpire - RK Illingworth, Batsman - L Embuldeniya (Struck down)",Sri Lanka (Batting),L Embuldeniya,RK Illingworth,Struck down,False,12.0,True,sl-vs-nz-1st-test-new-zealand-tour-of-sri-lanka-2019,Batting,False,True,True,False,4,0.2857142857142857,Sri Lanka,Somerville
New Zealand 1st innings,58.2,"Dananjaya to Henry Nicholls, out Lbw!! Nicholls has been given out LBW and he wants a review. It's a fair delivery, is there any bat on that? Was it spinning past the off-stump? Bruce Oxenford wants the UltraEdge and there's clear daylight between bat, glove and the ball. Pitching in line, the impact is in line and it's hitting middle and leg. Three REDS and Nicholls is OUT. Fourth wicket for Dananjaya and he's on a roll - this was tossed up around leg and then straightened a tad, Nicholls was down on the knees as he looked to sweep, beaten by the extra bounce that Dananjaya procures - struck on the back-thigh, the impact was in front of middle and would have been crashing into the middle and leg stump. Umpire Illingworth got it spot on and New Zealand have lost their first review. Henry Nicholls lbw b Dananjaya 42(78) [4s-2]",4,"Over 58.2: Review by New Zealand (Batting), Umpire - RK Illingworth, Batsman - HM Nicholls (Struck down)",New Zealand (Batting),HM Nicholls,RK Illingworth,Struck down,False,0.0,True,sl-vs-nz-1st-test-new-zealand-tour-of-sri-lanka-2019,Batting,False,True,True,False,4,0.2857142857142857,New Zealand,Dananjaya
South Africa 2nd innings,6.6,"Shami to du Plessis, out Lbw!! Shami's planning pays off finally. Went wide of the crease on two occasions prior to this against Faf. Both were fullish outswingers, one that was left alone and then saw one just beating the SA skipper's outside edge. On this occasion, the length is slightly shorter and the line is straighter as well. Faf gets pinned on the crease and is late to react as this straightens off the deck just a fraction to rap him on the back pad. The lower bounce didn't help either and it looked stone dead in real time. The umpire wasted no time in raising his finger but Faf, perhaps in desperation, went for the review. Was always going to be in trouble if he didn't hit this and UltraEdge confirms that he hasn't. As plumb as it gets. SA falling apart quickly once again. du Plessis lbw b Shami 4(10)",3,"Over 6.6: Review by South Africa (Batting), Umpire - NJ Llong, Batsman - F du Plessis (Struck down)",South Africa (Batting),F du Plessis,NJ Llong,Struck down,False,2.0,True,ind-vs-rsa-3rd-test-south-africa-tour-of-india-2019,Batting,False,True,True,False,2,0.25,South Africa,Shami
South Africa 1st innings,56.2,"Nadeem to Anrich Nortje, out Lbw!! Only an inside edge could have saved Nortje there. He was struck plumb in front. The slider which skids on, Nortje presses forward and is beaten by the in-drift, the ball strikes him in front of middle and ball-tracking shows it to be going on to crash into leg-stump. Anrich Nortje lbw b Nadeem 4(55)",10,"Over 56.2: Review by South Africa (Batting), Umpire - RK Illingworth, Batsman - A Nortje (Struck down)",South Africa (Batting),A Nortje,RK Illingworth,Struck down,False,7.0,True,ind-vs-rsa-3rd-test-south-africa-tour-of-india-2019,Batting,False,True,True,False,2,0.25,South Africa,Nadeem
South Africa 2nd innings,67.2,"Jadeja to Maharaj, out Lbw!! Final blow has been dealt by Jadeja. It was the quicker delivery, goes straight on and Maharaj is caught in the crease which led to his downfall. It crashes onto the pad in front of middle and only height was a factor that could've saved him. Tried his luck and took the review but in vain. A victory by an innings and 137 runs for India. As comprehensive as it gets. Maharaj lbw b Jadeja 22(65) [4s-3]",10,"Over 67.2: Review by South Africa (Batting), Umpire - CB Gaffaney, Batsman - KA Maharaj (Struck down)",South Africa (Batting),KA Maharaj,CB Gaffaney,Struck down,False,7.0,True,ind-vs-rsa-2nd-test-south-africa-tour-of-india-2019,Batting,False,True,True,False,2,0.2,South Africa,Jadeja
South Africa 1st innings,105.4,"Ashwin to Rabada, out Lbw!! Rabada has been adjudged lbw. And, he reviews. Fair delivery. No bat. Was it straightening enough to hit the sticks? Hitting leg and umpire Chris Gaffaney's on-field call stays. A floaty ball that drifted in and Rabada ended up playing down the wrong line trying to block. The ball straightened ever so lightly before striking the batter's front pad adjacent to leg. The ball-tracking shows it to be crashing into leg-stump. Ashwin finishes with four wickets and it's also stumps on day three. Rabada lbw b Ashwin 2(9)",10,"Over 105.4: Review by South Africa (Batting), Umpire - CB Gaffaney, Batsman - K Rabada (Struck down)",South Africa (Batting),K Rabada,CB Gaffaney,Struck down,False,9.0,True,ind-vs-rsa-2nd-test-south-africa-tour-of-india-2019,Batting,False,True,False,True,2,0.2,South Africa,Ashwin
South Africa 1st innings,44.2,"Jadeja to Senuran Muthusamy, out Lbw!! First dismissal for Senuran Muthusamy in Tests and he is out LBW because he offered no shot. That turned in from the rough and he was caught in the crease. There was a lot of spin on it but umpire Llong deemed it out and he was right as Hawkeye showed three reds. The impact was outside off but was taken out of the equation as he offered no shot. India breakthrough again. The umpire had a keen look and really took his time to deem him out. Senuran Muthusamy lbw b Jadeja 7(20)",7,"Over 44.2: Review by South Africa (Batting), Umpire - NJ Llong, Batsman - S Muthusamy (Struck down)",South Africa (Batting),S Muthusamy,NJ Llong,Struck down,False,6.0,True,ind-vs-rsa-2nd-test-south-africa-tour-of-india-2019,Batting,False,True,True,False,2,0.2,South Africa,Jadeja
India 2nd innings,50.6,"Philander to Pujara, out Lbw! Philander doesn't bother to appeal, that's how plumb that was! Pujara has reviewed this! NO WAY! Impact in line, hitting top of off-stump - O.U.T.!, as this straightener off the seam beats the leading edge of his would-be glance to strike him plumb in front, sealing his fate for the game. An unplayable delivery - that's the requirement to get Pujara out, and Philander has produced just that. Phenomenal bowling. Pujara lbw b Philander 81(148) [4s-13 6s-2]",2,"Over 50.6: Review by India (Batting), Umpire - RK Illingworth, Batsman - CA Pujara (Struck down)",India (Batting),CA Pujara,RK Illingworth,Struck down,False,5.0,True,ind-vs-rsa-1st-test-south-africa-tour-of-india-2019,Batting,False,True,True,False,3,0.3,India,Philander
Bangladesh 1st innings,6.3,"Ishant to Kayes, out Lbw!! This looked so out. Really good decision from Joel Wilson. Was under pressure after caught behind decision was reversed. But kept his cool, gave it a long thought and raised the finger. This is the new variety from Ishant, the leg-cutter that comes out scrambled seam and then cuts back in/holds its line from round the wicket. He's set Kayes with away-swingers and then slipped this in. Kayes's head was outside the line and he missed the ball completely looking to play to leg. Impact in line with middle and leg and given. He spoke to Shadman Islam and then sent the case upstairs, only to lose a review as ball-tracker says crashing leg pole. India get their first wicket. Kayes lbw b Ishant 4(15)",1,"Over 6.3: Review by Bangladesh (Batting), Umpire - JS Wilson, Batsman - Imrul Kayes (Struck down)",Bangladesh (Batting),Imrul Kayes,JS Wilson,Struck down,False,3.0,True,ind-vs-ban-2nd-test-bangladesh-tour-of-india-2019,Batting,False,True,True,False,3,0.375,Bangladesh,Ishant
Australia 2nd innings,55.6,"Jack Leach to Paine, out Lbw!! Paine leaves his way to his doom. And 2-2 tonight is a reality again. He goes back deep in the crease to a delivery he should ideally have been forward to, and then surprisingly leaves this ball that was straightening back from the line of leg. Dharmasena took forever to give this out - maybe in doing what Joel Wilson didn't, calculate who has their reviews left. Paine does. He sends it upstairs. And it's three reds, pitching just in line, and the rest was always plumb. Paine lbw b Jack Leach 21(34) [4s-4]",6,"Over 55.6: Review by Australia (Batting), Umpire - HDPK Dharmasena, Batsman - TD Paine (Struck down)",Australia (Batting),TD Paine,HDPK Dharmasena,Struck down,False,10.0,True,eng-vs-aus-5th-test-the-ashes-2019,Batting,False,True,True,False,5,0.38461538461538464,Australia,Jack Leach
Australia 1st innings,53.5,"Sam Curran to Pat Cummins, out Lbw!! The dreaded finger of umpire Marais Erasmus goes up in a flash and Cummins has been adjudged lbw. The batter has decided to challenge it. Fair delivery. It's the inswinger from Curran and Cummins is beaten on the inside edge. Three reds on HawkEye! Australia lose a review and Curran is on a hat-trick! That looked plumb to the naked eye! Full and swinging in, Cummins isn't equipped to keep it away as tries to push. Missed the inside edge, pinned the front pad in front of the sticks. The ball-tracking showed it to be hitting middle and leg. Pat Cummins lbw b Sam Curran 0(1)",7,"Over 53.5: Review by Australia (Batting), Umpire - M Erasmus, Batsman - PJ Cummins (Struck down)",Australia (Batting),PJ Cummins,M Erasmus,Struck down,False,11.0,True,eng-vs-aus-5th-test-the-ashes-2019,Batting,False,True,True,False,5,0.38461538461538464,Australia,Sam Curran
