innings,Over,Commentary,active_partnership,reviews,Review_team,Review_batsman,Review_umpire,Review_outcome,Umpires_call,index,Partnership_broken,match,innings_action,overturned,review_lost,first_review_lost,second_review_lost,overturned_decisions,ratio_overturned,team,bowler
India 1st innings,61.3,"Roach to Hanuma Vihari, leg byes, 1 run, horrible review from Roach. West Indies have lost both their reviews now. Angled in and Vihari falls over as he misses the flick, struck him around leg-stump and the angle was taking it further down. Holder gestured it was going down but Roach was adamant that it was close",5,"Over 61.3: Review by West Indies (Bowling), Umpire - PR Reiffel, Batsman - GH Vihari (Struck down)",West Indies (Bowling),GH Vihari,PR Reiffel,Struck down,False,8.0,False,wi-vs-ind-2nd-test-india-tour-of-west-indies-2019,Bowling,False,True,False,True,2,0.2222222222222222,West Indies,Roach
India 1st innings,20.3,"Cornwall to Kohli, no run, a huge lbw appeal and it's been turned down! West Indies have decided to challenge the onfield call, after all it's the Indian skipper. This looks close but it could be probably spinning down the leg side. Huge amount of spin and Kohli gets beaten due to the same on his flick. Nothing on UltraEdge, the impact is in line and it's missing the leg stump by a huge margin. Could have probably hit the sixth stump, if there was one. So, West Indies have lost one review and Kohli still has the chance to open his account",3,"Over 20.3: Review by West Indies (Bowling), Umpire - RA Kettleborough, Batsman - V Kohli (Struck down)",West Indies (Bowling),V Kohli,RA Kettleborough,Struck down,False,0.0,False,wi-vs-ind-2nd-test-india-tour-of-west-indies-2019,Bowling,False,True,True,False,2,0.2222222222222222,West Indies,Cornwall
India 2nd innings,27.4,"Cornwall to Rahane, no run, reviewed for the sake of it. Cornwall was not convinced. He didn't even appeal but Hamilton was and Holder went with his keeper's word. Rahane jumps out of the crease and is defeated by the turn in, beaten on the inside edge and the ball pops up off the flap of the pad, Hamilton hangs on to the ball and goes up immediately",4,"Over 27.4: Review by West Indies (Bowling), Umpire - PR Reiffel, Batsman - AM Rahane (Struck down)",West Indies (Bowling),AM Rahane,PR Reiffel,Struck down,False,6.0,False,wi-vs-ind-2nd-test-india-tour-of-west-indies-2019,Bowling,False,True,True,False,2,0.2222222222222222,West Indies,Cornwall
West Indies 2nd innings,22.5,"Ishant to Roston Chase, no run, that's hooped back in at Chase who's clearly staggered. He was prepared to leave it, saw it bend in sharply and made a belated, albeit unsuccessful attempt to keep it from hitting the front pad. Huge shout from India. Umpire Kettleborough says no. Not much hesitation from Kohli in going for the review, but ball-tracking has it going over the stumps. Even the impact was umpire's call on off stump",3,"Over 22.5: Review by India (Bowling), Umpire - RA Kettleborough, Batsman - RL Chase (Struck down)",India (Bowling),RL Chase,RA Kettleborough,Struck down,False,3.0,False,wi-vs-ind-2nd-test-india-tour-of-west-indies-2019,Bowling,False,True,True,False,2,0.2222222222222222,India,Ishant
West Indies 1st innings,44.2,"Ishant to Roach, no run, another sharp bouncer outside off, good carry on it, Roach tries to fend it away, but gets beaten due to the bounce. Pant was up in a caught behind appeal and the Indians have used up a review too. But replays show there was daylight when the ball whizzed past his gloves. India have lost one review - one remaining",9,"Over 44.2: Review by India (Bowling), Umpire - PR Reiffel, Batsman - KAJ Roach (Struck down)",India (Bowling),KAJ Roach,PR Reiffel,Struck down,False,1.0,False,wi-vs-ind-2nd-test-india-tour-of-west-indies-2019,Bowling,False,True,True,False,2,0.2222222222222222,India,Ishant
West Indies 2nd innings,15.5,"Bumrah to Roach, no run, loud shout for LBW and India have decided to review. was it swinging down leg? Was it high? It's a fair delivery and it has hit Roach above the knee-roll, almost around the flap of the pad, no bat and UltraEdge confirms it, sliding past leg-stump and India lose a review. An optimistic review from India, but you wouldn't blamce them too much. On a good length and kept coming with the angle, Roach was pushing forward in defence and is beaten on the inside edge, struck him in front of leg and that was always sliding down",8,"Over 15.5: Review by India (Bowling), Umpire - RJ Tucker, Batsman - KAJ Roach (Struck down)",India (Bowling),KAJ Roach,RJ Tucker,Struck down,False,7.0,False,wi-vs-ind-1st-test-india-tour-of-west-indies-2019,Bowling,False,True,False,True,4,0.36363636363636365,India,Bumrah
West Indies 2nd innings,15.4,"Bumrah to Roach, no run, fuller length delivery and holding its line outside off, Roach covers the line, lifts his bat and lets it go",8,"Over 15.4: Review by India (Bowling), Umpire - RJ Tucker, Batsman - KAJ Roach (Struck down)",India (Bowling),KAJ Roach,RJ Tucker,Struck down,False,3.0,False,wi-vs-ind-1st-test-india-tour-of-west-indies-2019,Bowling,False,True,True,False,4,0.36363636363636365,India,Bumrah
India 2nd innings,44.2,"Roach to Rahane, no run, loud shout for LBW and West Indies will review. Rahane was shuffling a long way across, but was the angle taking the ball down leg? Looks like no bat on that and UltraEdge confirms it. The impact is in front of leg and is sliding down leg, poor review from West Indies. Looked like going down to the naked eye and Hawk-Eye confirmed it, full and angling into Rahane's pads, he was looking to flick and missed",4,"Over 44.2: Review by West Indies (Bowling), Umpire - RJ Tucker, Batsman - AM Rahane (Struck down)",West Indies (Bowling),AM Rahane,RJ Tucker,Struck down,False,2.0,False,wi-vs-ind-1st-test-india-tour-of-west-indies-2019,Bowling,False,True,True,False,4,0.36363636363636365,West Indies,Roach
West Indies 1st innings,73.2,"Shami to Gabriel, no run, An lbw appeal against Gabriel and umpire Richard Kettleborough is unmoved. An in-angler at 139kph and Gabriel is late on the glance. The impact is outside leg and that's going further down. India lose a review",10,"Over 73.2: Review by India (Bowling), Umpire - RA Kettleborough, Batsman - ST Gabriel (Struck down)",India (Bowling),ST Gabriel,RA Kettleborough,Struck down,False,10.0,False,wi-vs-ind-1st-test-india-tour-of-west-indies-2019,Bowling,False,True,True,False,4,0.36363636363636365,India,Shami
Sri Lanka 2nd innings,44.6,"Boult to Dilruwan Perera, no run, another review for an lbw - this time the original decision is not out and Kane has decided to go upstairs. This looks like it pitched outside leg, hence the batsman might get away with it. Was a toe-crushing yorker by Boult and the batsman was in no postion to play it. Dilruwan Perera tried his best to squeeze it out but the jaffa was too good for him. Had it pitched in line, this could have been plumb. A game of fine margins, isn't it? Meanwhile, the batsman getting some treatment as he seems to be rattled by the impact. Good decision, nevertheless..",7,"Over 44.6: Review by New Zealand (Bowling), Umpire - MA Gough, Batsman - MDK Perera (Struck down)",New Zealand (Bowling),MDK Perera,MA Gough,Struck down,False,7.0,False,sl-vs-nz-2nd-test-new-zealand-tour-of-sri-lanka-2019,Bowling,False,True,True,False,1,0.2,New Zealand,Boult
Sri Lanka 2nd innings,79.4,"Somerville to Kusal Perera, no run, Perera tries the reverse sweep and misses, impact outside off stump on the back thigh, KW took the chance with the review and ended up duming on",4,"Over 79.4: Review by New Zealand (Bowling), Umpire - MA Gough, Batsman - MDKJ Perera (Struck down)",New Zealand (Bowling),MDKJ Perera,MA Gough,Struck down,False,11.0,False,sl-vs-nz-1st-test-new-zealand-tour-of-sri-lanka-2019,Bowling,False,True,True,False,4,0.2857142857142857,New Zealand,Somerville
New Zealand 2nd innings,103.2,"Dhananjaya de Silva to Ajaz Patel, no run, appeal for LBW and Sri Lanka want a review. The impact was definitely outside off, but Ajaz wasn't playing a shot. Did it spin back enough to hit the stumps? It's missing and Sri Lanka have now lost both reviews. Fraction short and spinning back into the left-hander, Ajaz was caught in between playing and leaving, left it at the last moment and was hit on the pads",10,"Over 103.2: Review by Sri Lanka (Bowling), Umpire - MA Gough, Batsman - AY Patel (Struck down)",Sri Lanka (Bowling),AY Patel,MA Gough,Struck down,False,10.0,False,sl-vs-nz-1st-test-new-zealand-tour-of-sri-lanka-2019,Bowling,False,True,False,True,4,0.2857142857142857,Sri Lanka,Dhananjaya de Silva
New Zealand 2nd innings,61.6,"Dananjaya to Watling, no run, wrong 'un and not sure Watling picked it, he pressed forward to defend and the ball grazes the inside edge before hitting the pad, the impact was in-line with middle and that prompted Sri Lanka to take the review. Guess no one spotted the tiny bit of wood. Only one review left for the hosts",7,"Over 61.6: Review by Sri Lanka (Bowling), Umpire - MA Gough, Batsman - BJ Watling (Struck down)",Sri Lanka (Bowling),BJ Watling,MA Gough,Struck down,False,6.0,False,sl-vs-nz-1st-test-new-zealand-tour-of-sri-lanka-2019,Bowling,False,True,True,False,4,0.2857142857142857,Sri Lanka,Dananjaya
Sri Lanka 1st innings,88.5,"Boult to Lasith Embuldeniya, no run, loud shout for LBW and KW will not get any advice from the close-in cordon, makes a belated call for a review. To the naked eye, this looked like slipping down leg. It's a fair ball and it has missed the bat. UltraEdge confirms it. The impact is in front of leg and the angle should be taking it past the leg-stump. Missing and New Zealand have lost their second review as well. This was very full and kept sliding down the leg-side, Embuldeniya was looking to flick and missed",9,"Over 88.5: Review by New Zealand (Bowling), Umpire - MA Gough, Batsman - L Embuldeniya (Struck down)",New Zealand (Bowling),L Embuldeniya,MA Gough,Struck down,False,9.0,False,sl-vs-nz-1st-test-new-zealand-tour-of-sri-lanka-2019,Bowling,False,True,False,True,4,0.2857142857142857,New Zealand,Boult
Sri Lanka 1st innings,27.1,"Santner to Kusal Mendis, no run, Santner gets it to skid off the deck and Kusal Mendis misses the tuck. It rapped him on the pads but was sliding down. It didn't straighten enough but  Kane thought otherwise and went for the review, he was proved wrong within a minute. New Zealand lose their review too",3,"Over 27.1: Review by New Zealand (Bowling), Umpire - RK Illingworth, Batsman - BKG Mendis (Struck down)",New Zealand (Bowling),BKG Mendis,RK Illingworth,Struck down,False,1.0,False,sl-vs-nz-1st-test-new-zealand-tour-of-sri-lanka-2019,Bowling,False,True,True,False,4,0.2857142857142857,New Zealand,Santner
South Africa 1st innings,41.3,"Ashwin to George Linde, no run, George Linde went for the slog across the line and missed it. The ball hit him on the front pad and the impact was on leg-stick. There was no bat as HawkEye clarified but that was also going down leg. But was it a slider? Not sure",9,"Over 41.3: Review by India (Bowling), Umpire - NJ Llong, Batsman - GF Linde (Struck down)",India (Bowling),GF Linde,NJ Llong,Struck down,False,5.0,False,ind-vs-rsa-3rd-test-south-africa-tour-of-india-2019,Bowling,False,True,False,True,2,0.25,India,Ashwin
South Africa 1st innings,27.3,"Jadeja to Zubayr Hamza, no run, India review: This looks to be sliding down the leg side to the naked eye. India might lose their review. Yup, they have. Was a fullish delivery around middle and leg, Zubayr Hamza was trying to defend it, but the ball kept straight and struck him on the pads. Impact was on leg, but the angle was taking it down the leg side. Reviews left: South Africa - 2 | India - 1",4,"Over 27.3: Review by India (Bowling), Umpire - NJ Llong, Batsman - Zubayr Hamza (Struck down)",India (Bowling),Zubayr Hamza,NJ Llong,Struck down,False,1.0,False,ind-vs-rsa-3rd-test-south-africa-tour-of-india-2019,Bowling,False,True,True,False,2,0.25,India,Jadeja
India 1st innings,80.4,"D Piedt to Rohit, leg byes, 1 run, South Africa have a review: It's an ungainly slog sweep. Well, well, Sharma's clearly bored here with Piedt's negative lines from round the wicket into his pads. So he decides to have a slog-sweep, misses, but the balls pitching a cool few centimeters down leg",5,"Over 80.4: Review by South Africa (Bowling), Umpire - RK Illingworth, Batsman - RG Sharma (Struck down)",South Africa (Bowling),RG Sharma,RK Illingworth,Struck down,False,8.0,False,ind-vs-rsa-3rd-test-south-africa-tour-of-india-2019,Bowling,False,True,True,False,2,0.25,South Africa,D Piedt
South Africa 2nd innings,43.1,"Jadeja to Bavuma, no run, loud shout for LBW and then RJ thinks there might be bat there, somehow convinces Kohli into a review. It's a fair delivery, don't think there's any bat and I reckon the ball is spinning away from the stumps. UltraEdge confirms no bat/glove. It's a terrible review, the impact is miles outside off and India lose a review. This was tossed up outside off and spun away, Bavuma got a big stride across as he looked to lap and missed",6,"Over 43.1: Review by India (Bowling), Umpire - CB Gaffaney, Batsman - T Bavuma (Struck down)",India (Bowling),T Bavuma,CB Gaffaney,Struck down,False,5.0,False,ind-vs-rsa-2nd-test-south-africa-tour-of-india-2019,Bowling,False,True,True,False,2,0.2,India,Jadeja
South Africa 1st innings,102.6,"Jadeja to Rabada, no run, in-turner, Rabada looks play against the break. The keeper takes it and there's an appeal for caught-behind. Not given and it's been challenged. Fair delivery. Spun a long way and it missed the inside edge by a long way. India have burnt a review here",10,"Over 102.6: Review by India (Bowling), Umpire - NJ Llong, Batsman - K Rabada (Struck down)",India (Bowling),K Rabada,NJ Llong,Struck down,False,8.0,False,ind-vs-rsa-2nd-test-south-africa-tour-of-india-2019,Bowling,False,True,True,False,2,0.2,India,Jadeja
India 1st innings,100.1,"Maharaj to Rahane, no run, Loud shout for LBW, Faf has a chat with his keeper and South Africa will review. It's a fair delivery, but did it pitch outside leg? No bat and UltraEdge confirms it. He's struck bang in front of middle, but the ball has pitched outside leg. South Africa will lose their first review. NOT OUT is the call. Lovely first delivery from Maharaj, tossed up from round the wicket, drifted in and then spun across the right-hander, opened up Rahane completely as he went back in defence",4,"Over 100.1: Review by South Africa (Bowling), Umpire - CB Gaffaney, Batsman - AM Rahane (Struck down)",South Africa (Bowling),AM Rahane,CB Gaffaney,Struck down,False,3.0,False,ind-vs-rsa-2nd-test-south-africa-tour-of-india-2019,Bowling,False,True,True,False,2,0.2,South Africa,Maharaj
India 2nd innings,52.6,"Philander to Jadeja, no run, Review by SA for LBW! Skids through quickly from a good length spot, and has his bat and pad together in defence. There's a spike on UltraEdge when the ball passes the pad before getting to the bat. The third umpire is convinced it's pad first! Umpire's call on impact, wickets missing, and South Africa lose one review.",3,"Over 52.6: Review by South Africa (Bowling), Umpire - RK Illingworth, Batsman - RA Jadeja (Struck down)",South Africa (Bowling),RA Jadeja,RK Illingworth,Struck down,False,8.0,False,ind-vs-rsa-1st-test-south-africa-tour-of-india-2019,Bowling,False,True,True,False,3,0.3,South Africa,Philander
South Africa 1st innings,108.5,"Shami to Senuran Muthusamy, no run, was always a risky review from India who were clearly getting frustrated with the Protea defiance today. This was the in-angler from a good length, rapping Muthusamy on the pad in front of leg stump. Looked to be going down leg in real time and HawkEye confirms the same. Review lost!",7,"Over 108.5: Review by India (Bowling), Umpire - CB Gaffaney, Batsman - S Muthusamy (Struck down)",India (Bowling),S Muthusamy,CB Gaffaney,Struck down,False,1.0,False,ind-vs-rsa-1st-test-south-africa-tour-of-india-2019,Bowling,False,True,True,False,3,0.3,India,Shami
Bangladesh 2nd innings,8.3,"Ishant to Rahim, leg byes, 1 run, highly optimistic LBW appeal and review from Ishant. Too much movement, Saha should have said no for the DRS. They were hoping to get away with umpire's call but ball-tracker says missing leg stump. Rahim is beaten on the flick by this big inswinger, impact on middle and leg, Ishant was adamant about the review. Most bowlers are",6,"Over 8.3: Review by India (Bowling), Umpire - M Erasmus, Batsman - Mushfiqur Rahim (Struck down)",India (Bowling),Mushfiqur Rahim,M Erasmus,Struck down,False,8.0,False,ind-vs-ban-2nd-test-bangladesh-tour-of-india-2019,Bowling,False,True,True,False,3,0.375,India,Ishant
Bangladesh 1st innings,7.2,"Shami to Shadman Islam, no run, this is a brilliant decision from umpire Marais Erasmus. Shami ran in to get this short of length delivery to cut back in, Islam was beaten on the defence, clear sound and big deviation as well, it looked like a definite edge but Marais was so calm and shook his head. India had a chat and then reviewed. On the first replay, it was evident the bat was a long way away and it just went off the thigh pad. Islam looking behind also confused many. That was a stunning right-handed diving grab by Saha though",2,"Over 7.2: Review by India (Bowling), Umpire - M Erasmus, Batsman - Shadman Islam (Struck down)",India (Bowling),Shadman Islam,M Erasmus,Struck down,False,6.0,False,ind-vs-ban-2nd-test-bangladesh-tour-of-india-2019,Bowling,False,True,True,False,3,0.375,India,Shami
Bangladesh 2nd innings,13.4,"U Yadav to Mithun, no run, tailed in a long way and Mithun plays down the wrong line only to get rammed on the front pad. Umpire Marais Erasmus shook his head and in the end, he was proved right. The angle and excess movement took it down leg",4,"Over 13.4: Review by India (Bowling), Umpire - M Erasmus, Batsman - Mohammad Mithun (Struck down)",India (Bowling),Mohammad Mithun,M Erasmus,Struck down,False,5.0,False,ind-vs-ban-1st-test-bangladesh-tour-of-india-2019,Bowling,False,True,False,True,3,0.5,India,U Yadav
Bangladesh 2nd innings,5.5,"U Yadav to Mominul, no run, loud shout for LBW, did the ball come back enough to hit the stump? Anyway, India have decided to review. No shot offered, so the impact doesn't matter. It's a fair delivery. Don't think the ball has come back enough and ball-tracking confirms it. Good call from Erasmus, it's NOT OUT. India lose their first review, on a good length and just a hint of nip back into the left-hander, Mominul covered the line and then let it go, brushed the pads on its way to the keeper and that got the Indians excited",2,"Over 5.5: Review by India (Bowling), Umpire - M Erasmus, Batsman - Mominul Haque (Struck down)",India (Bowling),Mominul Haque,M Erasmus,Struck down,False,2.0,False,ind-vs-ban-1st-test-bangladesh-tour-of-india-2019,Bowling,False,True,True,False,3,0.5,India,U Yadav
Australia 2nd innings,48.6,"Jofra Archer to Wade, no run, England review -- Okay, Wade is undone by the pace here as he falls over on the flick and is struck on the front pad. There's no doubt that it's hitting the stumps, but then, it's pitching down leg, comfortably. It was always going to be dodgy with these over the wicket angles to left-handers",6,"Over 48.6: Review by England (Bowling), Umpire - M Erasmus, Batsman - MS Wade (Struck down)",England (Bowling),MS Wade,M Erasmus,Struck down,False,7.0,False,eng-vs-aus-5th-test-the-ashes-2019,Bowling,False,True,False,True,5,0.38461538461538464,England,Jofra Archer
Australia 2nd innings,44.1,"Jofra Archer to Paine, no run, caught at short leg. Marais Erasmus is unmoved. England review. Clearly, no bat. Even UltraEdge isn't needed. Over to HawkEye now. Comfortably missing leg. England have burnt a review here. Bad call to send it upstairs. A pacy in-slanter and Paine is beaten for pace as he looks to work it through the leg-side, misses the inside edge and pings the front leg before going into the hands of the short leg fielder",6,"Over 44.1: Review by England (Bowling), Umpire - M Erasmus, Batsman - TD Paine (Struck down)",England (Bowling),TD Paine,M Erasmus,Struck down,False,3.0,False,eng-vs-aus-5th-test-the-ashes-2019,Bowling,False,True,True,False,5,0.38461538461538464,England,Jofra Archer
Australia 1st innings,32.3,"Woakes to Wade, no run, So England review an LBW. Clearly nobody's trusting the umpires any longer. Wade's trapped on the back foot as this one nips in, beats his inside edge and smashes him on the front pad. But, but, it's high on the flap -- and HawkEye shows him to have shuffled across a little too much, striking him on umpire's call with the line of off, and then angling away and missing",4,"Over 32.3: Review by England (Bowling), Umpire - HDPK Dharmasena, Batsman - MS Wade (Struck down)",England (Bowling),MS Wade,HDPK Dharmasena,Struck down,False,5.0,False,eng-vs-aus-5th-test-the-ashes-2019,Bowling,False,True,True,False,5,0.38461538461538464,England,Woakes
England 1st innings,57.1,"Mitchell Marsh to Buttler, no run, an appeal for caught-down-the-leg-side. Not given and Australia decide to review. Fair delivery. A back of a length delivery on the ribs and Buttler missed the tuck. Clearly no inside edge  and the on-field call stays. Australia have burned a review here. It clipped the thigh pad before going into the mitts of the keeper",5,"Over 57.1: Review by Australia (Bowling), Umpire - M Erasmus, Batsman - JC Buttler (Struck down)",Australia (Bowling),JC Buttler,M Erasmus,Struck down,False,4.0,False,eng-vs-aus-5th-test-the-ashes-2019,Bowling,False,True,True,False,5,0.38461538461538464,Australia,Mitchell Marsh
Australia 2nd innings,42.3,"Pat Cummins to Buttler, no run, good length ball outside off, Buttler lifts his bat and lets it go",6,"Over 42.3: Review by England (Bowling), Umpire - M Erasmus, Batsman - MA Starc (Struck down)",England (Bowling),MA Starc,M Erasmus,Struck down,False,10.0,False,eng-vs-aus-4th-test-the-ashes-2019,Bowling,False,True,False,True,1,0.1111111111111111,England,Pat Cummins
Australia 2nd innings,31.5,"Hazlewood to Denly, FOUR, shot! Full and outside off, Denly leans forward and drives it on the rise through cover. A dangerous shot to play but Denly usually fancies himself on the drive and this time he was able to middle it",5,"Over 31.5: Review by England (Bowling), Umpire - HDPK Dharmasena, Batsman - MS Wade (Struck down)",England (Bowling),MS Wade,HDPK Dharmasena,Struck down,False,8.0,False,eng-vs-aus-4th-test-the-ashes-2019,Bowling,False,True,True,False,1,0.1111111111111111,England,Hazlewood
England 2nd innings,76.1,"Pat Cummins to Bairstow, no run, fuller length delivery and holding its line outside off, has Bairstow pushing forward and beats him on the outside edge",6,"Over 76.1: Review by Australia (Bowling), Umpire - M Erasmus, Batsman - C Overton (Struck down)",Australia (Bowling),C Overton,M Erasmus,Struck down,False,7.0,False,eng-vs-aus-4th-test-the-ashes-2019,Bowling,False,True,True,False,1,0.1111111111111111,Australia,Pat Cummins
Australia 1st innings,119.3,"Root to Starc, 1 run, that's a top decision from umpire Marais Erasmus. It was a real feather and he managed to spot that. Sliding on from round the wicket and Starc goes for the paddle, he was struck in-line but that was after the ball had brushed the glove",1,"Over 119.3: Review by England (Bowling), Umpire - M Erasmus, Batsman - MA Starc (Struck down)",England (Bowling),MA Starc,M Erasmus,Struck down,False,0.0,False,eng-vs-aus-4th-test-the-ashes-2019,Bowling,False,True,True,False,1,0.1111111111111111,England,Root
England 2nd innings,123.6,"Pat Cummins to Jack Leach, no run, leg-lined yorker. Leach can't lay bat, but it's pitching clearly down leg as he gets pinned on the front leg. There's barely an appeal, but when desperation hits, why not kill time in reviewing. So the Aussies do, and it's clearly pitching a foot down",10,"Over 123.6: Review by Australia (Bowling), Umpire - CB Gaffaney, Batsman - MJ Leach (Struck down)",Australia (Bowling),MJ Leach,CB Gaffaney,Struck down,False,16.0,False,eng-vs-aus-3rd-test-the-ashes-2019,Bowling,False,True,False,True,7,0.4117647058823529,Australia,Pat Cummins
England 2nd innings,58.4,"Lyon to Denly, no run, this time Australia have gone for the review, but ball-tracking shows that it's comfortably turning down leg. Denly's hit on the pad again but he's well forward and the turn is significant. Not a smart review",3,"Over 58.4: Review by Australia (Bowling), Umpire - JS Wilson, Batsman - JL Denly (Struck down)",Australia (Bowling),JL Denly,JS Wilson,Struck down,False,7.0,False,eng-vs-aus-3rd-test-the-ashes-2019,Bowling,False,True,True,False,7,0.4117647058823529,Australia,Lyon
Australia 2nd innings,7.4,"Broad to Marcus Harris, no run, and I'm sure they're going for the review. Yep, they are! An LBW shout, and it looked plumb! Not a no-ball. The seam wobbles, beats the inside edge, flat line on UltraEdge as the in-seamer beats the inside edge. Struck in line but that's seaming in too much from round the wicket - misses the leg-stump. A good decision by Mr. Wilson. My bad!",2,"Over 7.4: Review by England (Bowling), Umpire - JS Wilson, Batsman - MS Harris (Struck down)",England (Bowling),MS Harris,JS Wilson,Struck down,False,6.0,False,eng-vs-aus-3rd-test-the-ashes-2019,Bowling,False,True,True,False,7,0.4117647058823529,England,Broad
Australia 2nd innings,45.4,"Jack Leach to Pat Cummins, no run, just a speculative review from Root. From over the wicket, this is clearly spinning away from off stump as Cummins pads up to it. Missing comfortably",7,"Over 45.4: Review by England (Bowling), Umpire - Aleem Dar, Batsman - PJ Cummins (Struck down)",England (Bowling),PJ Cummins,Aleem Dar,Struck down,False,7.0,False,eng-vs-aus-2nd-test-the-ashes-2019,Bowling,False,True,False,True,2,0.15384615384615385,England,Jack Leach
