innings,Over,Commentary,active_partnership,reviews,Review_team,Review_batsman,Review_umpire,Review_outcome,Umpires_call,index,Partnership_broken,match,innings_action,overturned,review_lost,first_review_lost,second_review_lost,overturned_decisions,ratio_overturned,team,bowler
England 1st innings,59.4,"Mitchell Marsh to Bairstow, out Lbw!! Bairstow has been adjudged lbw by umpire Marais Erasmus and he has reviewed that call. Fair delivery. A big, booming inswinger and it crashes into Bairstow's front pad. No bat. Three reds on HawkEye! England waste a review. After all those outswingers, Marsh gets one to curl into the right-hander and Bairstow had no clue against it. The length was perfect too - a toe-crushing yorker and Bairstow was too late in bringing his bat down. The ball-tracking showed it to be hitting leg. Superb bowling, this from Marsh. He is pumped up! Bairstow lbw b Mitchell Marsh 22(55) [4s-3]",5,"Over 59.4: Review by England (Batting), Umpire - M Erasmus, Batsman - JM Bairstow (Struck down)",England (Batting),JM Bairstow,M Erasmus,Struck down,False,8.0,True,eng-vs-aus-5th-test-the-ashes-2019,Batting,False,True,True,False,5,0.38461538461538464,England,Mitchell Marsh
England 2nd innings,115.2,"Pattinson to Broad, out Lbw!! Dead. Buried. Dead-in-glee. It's a vicious yorker, absolute brute, and umpire Gaffaney ups his DRS Karma points. Broad's mind knows only one thing, the bouncer, and he's perpetually ready, jumping up to Pattinson's proper bluffing yorker that sneaks under his bat and pins him plumb on the front boot. Three Reds.  Never mind the review .. Broad lbw b Pattinson 0(2)",9,"Over 115.2: Review by England (Batting), Umpire - CB Gaffaney, Batsman - SCJ Broad (Struck down)",England (Batting),SCJ Broad,CB Gaffaney,Struck down,False,13.0,True,eng-vs-aus-3rd-test-the-ashes-2019,Batting,False,True,True,False,7,0.4117647058823529,England,Pattinson
Australia 2nd innings,53.3,"Broad to Paine, out Caught by Denly!! This time the finger is raised. It appears that Paine was given leg-before on the field, a decision he challenges immediately due to the involvement of an inside edge. But even the catch was taken at gully, which Paine was aware of. So, all in all, it's a strange review. He would've been out one way or another. Actually, ball-tracking had it going over the stumps. But, come on, it's still a strange review. Paine c Denly b Broad 0(2)",6,"Over 53.3: Review by Australia (Batting), Umpire - JS Wilson, Batsman - TD Paine (Struck down)",Australia (Batting),TD Paine,JS Wilson,Struck down,False,15.0,True,eng-vs-aus-3rd-test-the-ashes-2019,Batting,False,True,True,False,7,0.4117647058823529,Australia,Broad
England 1st innings,26.4,"Pat Cummins to Jofra Archer, out Caught by Paine!! Archer reviews just for the sake of it. Don't think he truly believes he's going to get away. Had left his bat hanging up while ducking underneath the short ball and such is the state of England's shambles that it flicks the bat-face through to Paine. Jofra Archer c Paine b Pat Cummins 7(8) [4s-1]",9,"Over 26.4: Review by England (Batting), Umpire - CB Gaffaney, Batsman - JC Archer (Struck down)",England (Batting),JC Archer,CB Gaffaney,Struck down,False,5.0,True,eng-vs-aus-3rd-test-the-ashes-2019,Batting,False,True,True,False,7,0.4117647058823529,England,Pat Cummins
Australia 1st innings,51.2,"Stokes to Labuschagne, out Lbw! Given out and it's reviewed by Australia! Unless the impact is outside off, I don't see this being overturned. A surprise of a full-toss in store for Labuschagne, who is struck on the back-pad. Is there bat? Might be! Nope, no bat. Impact in-line, that was the only thing that could have saved him, and the dipping full-toss is crashing into the very center of the middle-pole. A rather eccentric dismissal, that found Labuschagne on his knees at the end of it all, but an important one for England. Labuschagne lbw b Stokes 74(129) [4s-10]",9,"Over 51.2: Review by Australia (Batting), Umpire - JS Wilson, Batsman - M Labuschagne (Struck down)",Australia (Batting),M Labuschagne,JS Wilson,Struck down,False,14.0,True,eng-vs-aus-3rd-test-the-ashes-2019,Batting,False,True,False,True,7,0.4117647058823529,Australia,S
Australia 1st innings,49.6,"Jofra Archer to Pat Cummins, out Caught by Bairstow! The Archer hits bull's eye! Maiden five-for for him. Or is it? Pat Cummins has gone for the review. Yep, there's a spike as the ball goes past the bat, but there was already some background noise. Well, certainly some scope for controversy here. No conclusive evidence, but also, to the naked eye, no visible daylight between bat and ball and nothing else that could have produced the noise. The ball - a good length one in the zone, jagging away just a little to find the outside edge, giving Jofra his fifth wicket! Pat Cummins c Bairstow b Jofra Archer 0(13)",8,"Over 49.6: Review by Australia (Batting), Umpire - JS Wilson, Batsman - PJ Cummins (Struck down)",Australia (Batting),PJ Cummins,JS Wilson,Struck down,False,11.0,True,eng-vs-aus-3rd-test-the-ashes-2019,Batting,False,True,True,False,7,0.4117647058823529,Australia,Jofra Archer
Australia 1st innings,93.1,"Jack Leach to Lyon, out Lbw!! Given out on the field. Lyon's decided to take it upstairs. The thing to watch here is whether this is sliding down. It came in with the arm from Leach, had Lyon playing outside the line of it. Ball-tracking's verdict is that it's hitting middle and leg. The ball had actually straightened enough from round the wicket. Lyon lbw b Jack Leach 6(17)",9,"Over 93.1: Review by Australia (Batting), Umpire - CB Gaffaney, Batsman - NM Lyon (Struck down)",Australia (Batting),NM Lyon,CB Gaffaney,Struck down,False,12.0,True,eng-vs-aus-2nd-test-the-ashes-2019,Batting,False,True,False,True,2,0.15384615384615385,Australia,Jack Leach
Australia 1st innings,87.5,"Woakes to Smith, out Lbw!! A token review from Smith who knows he's gone. He's padded up to a full ball that's come in with the angle, hitting him right in front of off stump. Just a horrible misjudgement wherein he expected the ball to swing away from him. Ball-tracking inevitably returns three reds, and Smith has almost crossed the boundary. Another great knock from him though, which is recognized with a generous applause by the majority of the crowd to drown everything else. Smith lbw b Woakes 92(161) [4s-14]",8,"Over 87.5: Review by Australia (Batting), Umpire - CB Gaffaney, Batsman - SPD Smith (Struck down)",Australia (Batting),SPD Smith,CB Gaffaney,Struck down,False,11.0,True,eng-vs-aus-2nd-test-the-ashes-2019,Batting,False,True,True,False,2,0.15384615384615385,Australia,Woakes
England 1st innings,64.6,"Pat Cummins to Woakes, out Caught by Paine!! There's the wicket. There's the plan working for Australia and Cummins. Woakes has shown vulnerability to the short ball and Cummins has exploited that superbly. He kept going short and had him in all sort of trouble, this was an innocuous short ball angled down leg, but Woakes goes looking for the pull, the ball brushes the glove and Paine does the rest behind the stumps. Aleem Dar took his time before raising the finger but he made the right decision. Not sure how Woakes did not feel the ball taking the glove as he went for the review almost immediately. Woakes c Paine b Pat Cummins 32(62) [4s-3 6s-1]",7,"Over 64.6: Review by England (Batting), Umpire - Aleem Dar, Batsman - CR Woakes (Struck down)",England (Batting),CR Woakes,Aleem Dar,Struck down,False,8.0,True,eng-vs-aus-2nd-test-the-ashes-2019,Batting,False,True,True,False,2,0.15384615384615385,England,Pat Cummins
England 2nd innings,36.6,"Pat Cummins to Bairstow, out Caught by Bancroft!! Bairstow is very unlucky here. But he did feel it was above his wristband and hence challenged the decision. The third umpire had a couple of looks and deemed in favour of the bowling side. England have lost both their reviews now. Another short delivery that refuses to bounce, Bairstow bends and arches back, but the low bounce does him in, the ball hits the sweatband on the glove before lobbing to third slip. A simple catch for Australia and they were confident. Umpire Wilson needed a nudge and it came from his partner at square leg. A quick glance and up went the finger. Bairstow c Bancroft b Pat Cummins 6(8) [4s-1]",6,"Over 36.6: Review by England (Batting), Umpire - JS Wilson, Batsman - JM Bairstow (Struck down)",England (Batting),JM Bairstow,JS Wilson,Struck down,False,16.0,True,eng-vs-aus-1st-test-the-ashes-2019,Batting,False,True,False,True,10,0.5,England,Pat Cummins
England 2nd innings,25.5,"Lyon to Denly, out Caught by Bancroft!! A classical day-five dismissal this. Another peach from Lyon and he is getting a lot of assistance from the track, it spins sharply and there was a moment of indecision from Denly where he wasn't sure whether to go forward or stay in the crease. It clipped the inside edge of Denly and FSL takes a fine catch. Denly wasn't sure whether he had edged that and he went for the review. He was proved wrong within a minute and the umpire finally gets a decision right. Denly c Bancroft b Lyon 11(16) [4s-2]",3,"Over 25.5: Review by England (Batting), Umpire - Aleem Dar, Batsman - JL Denly (Struck down)",England (Batting),JL Denly,Aleem Dar,Struck down,False,11.0,True,eng-vs-aus-1st-test-the-ashes-2019,Batting,False,True,True,False,10,0.5,England,Lyon
Australia 1st innings,32.4,"Woakes to Head, out Lbw!! Aussies review. But when the review is one second before the timer goes out, you know how desperate this is. Okay, so Woakes' had Head trapped in the crease as this one stays low and beats him for pace to come back in off the pitch and catch him in front of middle. But Head - after a long plea - has a damn reluctant Smith's blessings to take it upstairs -- only to see three reds on the big screen. It pitches on middle, nips in and is struck on the knee roll. Head's already quite short, plus he's deep in the crease as well. Yea, the perfect recipe for disaster. But Woakes' got to be taking all the credit for this perfect set up .. across, across, across and then suddenly one comes back in to mess around with Head's head. Head lbw b Woakes 35(61) [4s-5]",4,"Over 32.4: Review by Australia (Batting), Umpire - JS Wilson, Batsman - TM Head (Struck down)",Australia (Batting),TM Head,JS Wilson,Struck down,False,8.0,True,eng-vs-aus-1st-test-the-ashes-2019,Batting,False,True,True,False,10,0.5,Australia,Woakes
Pakistan 2nd innings,75.3,"Lyon to Yasir Shah, out Lbw!! Shah is adjudged lbw, he has a word with his partner and shows the 'T' sign, meaning he's reviewing it. No problem with the legality of the delivery as front foot is okay. The TV umpire is checking if there's any bat on this. Nothing on snicko. Three reds and the on-field call stays. The centurion of the first innings and the thorn in the flesh for Australia, Shah has been undone by a quicker delivery from Lyon. He's on fire and picks up his fourth wicket. Round the wicket angle, quicker and going straight on after pitching. Shah misjudges the length and stayed back. It skids on and pins him on the back pad around the knee-roll. It looked plumb and umpire Richard Illingworth was spot on with his decision. Yasir Shah lbw b Lyon 13(26) [4s-1]",7,"Over 75.3: Review by Pakistan (Batting), Umpire - RK Illingworth, Batsman - Yasir Shah (Struck down)",Pakistan (Batting),Yasir Shah,RK Illingworth,Struck down,False,5.0,True,aus-vs-pak-2nd-test-pakistan-tour-of-australia-2019,Batting,False,True,True,False,1,0.125,Pakistan,Lyon
Pakistan 1st innings,65.2,"Starc to Shaheen Afridi, out Lbw!! Pakistan review: Afridi has been given out lbw first ball. He has a chat with his partner and opts to challenge the on-field call. No problem with the front foot. No bat as well and three reds says Hawkeye. He is a goner and Starc is on a hat-trick now. This looked pretty adjacent straightaway. Afridi just reviewed in hope. This was full, straight and at the stumps. The batsman is beaten for pace as it strikes him low on the pads in front of middle. Ball-tracking showed that it was crashing the leg-stump. Make that six wickets for Starc. 145kph thunderbolt which is too good for Afridi. Shaheen Afridi lbw b Starc 0(1)",8,"Over 65.2: Review by Pakistan (Batting), Umpire - MA Gough, Batsman - Shaheen Shah Afridi (Struck down)",Pakistan (Batting),Shaheen Shah Afridi,MA Gough,Struck down,False,7.0,True,aus-vs-pak-2nd-test-pakistan-tour-of-australia-2019,Batting,False,True,True,False,1,0.125,Pakistan,Starc
Australia 1st innings,151.6,"Yasir Shah to Starc, out Lbw!! Starc has been given OUT LBW and he wants a review. It's a fair delivery, don't think there's bat on that. HotSpot and Snicko confirm it, ball-tracking coming up, three reds and Starc is OUT. Australia are losing wickets in a hurry now - nicely tossed up on middle, Starc went back as he looked to play for the turn, this one went straight on, slid through and crashed into Starc's pads, the impact was in front of middle and the ball was crashing into the middle-stump. Simple call for umpire Illingworth. Starc lbw b Yasir Shah 5(8)",8,"Over 151.6: Review by Australia (Batting), Umpire - RK Illingworth, Batsman - MA Starc (Struck down)",Australia (Batting),MA Starc,RK Illingworth,Struck down,False,5.0,True,aus-vs-pak-1st-test-pakistan-tour-of-australia-2019,Batting,False,True,True,False,2,0.2857142857142857,Australia,Yasir Shah
