innings,Over,Commentary,active_partnership,reviews,Review_team,Review_batsman,Review_umpire,Review_outcome,Umpires_call,Partnership_broken,match
Australia 2nd innings,67.1,"Denly to Smith, 1 run, juicy drag down, but so damn slow that Smith loses all shape and timing as he pulls it away through mid-wicket",5,,,,,,,,"ENG vs AUS, 1st Test, The Ashes 2019"
Australia 2nd innings,66.6,"Woakes to Wade, no run, massive LBW appeal. Woakes, or maybe this pitch, produces a real scooter in this, staying really low off a good length with Wade caught trapped in front of off. But, but, he gets some sort of an inside edge on. Redemption, umpire Wilson!",5,,,,,,,,"ENG vs AUS, 1st Test, The Ashes 2019"
Australia 2nd innings,66.5,"Woakes to Smith, 1 run, 82.1mph, leg-lined, it's a glance, behind square",5,,,,,,,,"ENG vs AUS, 1st Test, The Ashes 2019"
Australia 2nd innings,66.4,"Woakes to Smith, no run, opens his defence now, dabbing it parallel to his eyeline, gully",5,,,,,,,,"ENG vs AUS, 1st Test, The Ashes 2019"
Australia 2nd innings,66.3,"Woakes to Smith, no run, 81.8mph, full, middle-lined, Smith walks, freezes, blocks. Oh you can write a code now, it's THAT predictable",5,,,,,,,,"ENG vs AUS, 1st Test, The Ashes 2019"
Australia 2nd innings,66.2,"Woakes to Wade, 1 run, 84.2mph, wider, giving him further room to free up his hands and slice it through sweeper",5,,,,,,,,"ENG vs AUS, 1st Test, The Ashes 2019"
Australia 2nd innings,66.1,"Woakes to Wade, no run, 77mph, tries rolling his fingers on the off-cutter. But Wade's waiting on his opened up point poke",5,,,,,,,,"ENG vs AUS, 1st Test, The Ashes 2019"
Australia 2nd innings,65.6,"Broad to Smith, no run, 82.2mph, slightly shorter, but still easily outside off. Smith now stands his ground in watching it through",5,,,,,,,,"ENG vs AUS, 1st Test, The Ashes 2019"
Australia 2nd innings,65.5,"Broad to Smith, no run, walks across, well across, in a fancy leave",5,,,,,,,,"ENG vs AUS, 1st Test, The Ashes 2019"
Australia 2nd innings,65.4,"Broad to Smith, no run, length, getting him driving, which is more an outside half of a slice to gully",5,,,,,,,,"ENG vs AUS, 1st Test, The Ashes 2019"
Australia 2nd innings,65.3,"Broad to Smith, FOUR, 79.4mph. And Smith just can't get more dismissive with these. Broad tries going round the wicket and with silly point now in, tries the double bluff with a yorker. But Smith, being Smith, is on a bluff of his own, staying ready for this with his shuffle to absolutely smash down the ground",5,,,,,,,,"ENG vs AUS, 1st Test, The Ashes 2019"
Australia 2nd innings,65.2,"Broad to Wade, 1 run, 82mph, quicker one jagging in off a pretty full length. Nah, Wade's not falling over a he whips it in front of square",5,,,,,,,,"ENG vs AUS, 1st Test, The Ashes 2019"
Australia 2nd innings,65.1,"Broad to Wade, no run, 85.3mph, a walk into the line down the pitch, blocking",5,,,,,,,,"ENG vs AUS, 1st Test, The Ashes 2019"
Australia 2nd innings,64.6,"Woakes to Wade, 1 run, short. Shot. Pulled crisply, but there is a deep square leg",5,,,,,,,,"ENG vs AUS, 1st Test, The Ashes 2019"
Australia 2nd innings,64.5,"Woakes to Wade, no run, there's the slower one - an off-cutter - on the stumps, which Wade shuffles to, and then bunts to leg after the shuffle",5,,,,,,,,"ENG vs AUS, 1st Test, The Ashes 2019"
Australia 2nd innings,64.4,"Woakes to Wade, no run, 84.2mph, slightly closer to off, getting Wade using his bat, and it's a poke to cover-point",5,,,,,,,,"ENG vs AUS, 1st Test, The Ashes 2019"
Australia 2nd innings,64.3,"Woakes to Wade, no run, 72.2mph, half-thinks a drive, stretching, but fully pulls out",5,,,,,,,,"ENG vs AUS, 1st Test, The Ashes 2019"
Australia 2nd innings,64.2,"Woakes to Wade, no run, 84mph, across, good length, Wade is still not keen",5,,,,,,,,"ENG vs AUS, 1st Test, The Ashes 2019"
Australia 2nd innings,64.1,"Woakes to Wade, no run, 84mph, dies down to the keeper on the bounce, with Wade sticking out a really huge stride in letting it slant past",5,,,,,,,,"ENG vs AUS, 1st Test, The Ashes 2019"
Australia 2nd innings,63.6,"Broad to Smith, no run, normal leave. So he CAN do it after all. Hmmm. Way outside off and left, human-like",5,,,,,,,,"ENG vs AUS, 1st Test, The Ashes 2019"
Australia 2nd innings,63.5,"Broad to Smith, no run, crunched off the front foot, bump-balling a crowd catch to Stokes at point. And Stokes being Stokes is happy to play along, throwing the ball up in the air to tease the cheering",5,,,,,,,,"ENG vs AUS, 1st Test, The Ashes 2019"
Australia 2nd innings,63.4,"Broad to Smith, no run, a lesser dramatized leave, smaller bat swish",5,,,,,,,,"ENG vs AUS, 1st Test, The Ashes 2019"
Australia 2nd innings,63.3,"Broad to Smith, no run, wildly left outside off. But Bairstow, has a wilder throw back that was meant to be at the stumps, but smashes into Smith's arm. Now, now .. careful",5,,,,,,,,"ENG vs AUS, 1st Test, The Ashes 2019"
Australia 2nd innings,63.2,"Broad to Smith, no run, 78.8mph, too full, and hence a squeezed forward drive to extra cover",5,,,,,,,,"ENG vs AUS, 1st Test, The Ashes 2019"
Australia 2nd innings,63.1,"Broad to Smith, no run, 80mph, it's a leave, although after the ball goes past him he swats his bat around to add to its swagger",5,,,,,,,,"ENG vs AUS, 1st Test, The Ashes 2019"
Australia 2nd innings,62.6,"Woakes to Wade, no run, stays late, softly tapping the angler across to point",5,,,,,,,,"ENG vs AUS, 1st Test, The Ashes 2019"
Australia 2nd innings,62.5,"Woakes to Wade, no run, 81.4mph, hits the good length, a neatly lined leave",5,,,,,,,,"ENG vs AUS, 1st Test, The Ashes 2019"
Australia 2nd innings,62.4,"Woakes to Wade, FOUR, 84mph, but an overpitch in it .. Wade whacks it hard, opening his bat face, even losing his bottom-hand as he slices it square. Lead>150",5,,,,,,,,"ENG vs AUS, 1st Test, The Ashes 2019"
Australia 2nd innings,62.3,"Woakes to Wade, no run, 84.4mph, leans out on the drive now, but just can't get under the overcook, eventually having to toe-end it out to mid-off",5,,,,,,,,"ENG vs AUS, 1st Test, The Ashes 2019"
Australia 2nd innings,62.2,"Woakes to Wade, no run, another camp across, this time letting length go by",5,,,,,,,,"ENG vs AUS, 1st Test, The Ashes 2019"
Australia 2nd innings,62.1,"Woakes to Wade, no run, 84.6mph, full, outside off, scoots through under the leave",5,,,,,,,,"ENG vs AUS, 1st Test, The Ashes 2019"
Australia 2nd innings,61.6,"Broad to Wade, 1 run, 78.1mph, too straight, plus Wade's already walking inside this to flick it better, fine leg",5,,,,,,,,"ENG vs AUS, 1st Test, The Ashes 2019"
Australia 2nd innings,61.5,"Broad to Smith, 1 run, keeps it wide, with Smith carving through to a deep sweeper",5,,,,,,,,"ENG vs AUS, 1st Test, The Ashes 2019"
Australia 2nd innings,61.4,"Broad to Smith, no run, another flashy leave, this time with the ball dying through to the keeper as well",5,,,,,,,,"ENG vs AUS, 1st Test, The Ashes 2019"
Australia 2nd innings,61.3,"Broad to Smith, no run, another wide pitched up. Smith shuffles, with a wafty manic bat swing in his leave",5,,,,,,,,"ENG vs AUS, 1st Test, The Ashes 2019"
Australia 2nd innings,61.2,"Broad to Smith, FOUR, redemption once. And redemption again. He's writing a boos to hoots manual for the ages -- thanks to this overtly friendly half volley outside off for him to drill through extra cover. Century #25, and just like #24, a chanceless gem",5,,,,,,,,"ENG vs AUS, 1st Test, The Ashes 2019"
Australia 2nd innings,61.1,"Broad to Smith, no run, 81.2mph, way outside off. Okay, the plan's quite clear, make Smith wait",5,,,,,,,,"ENG vs AUS, 1st Test, The Ashes 2019"
Australia 2nd innings,60.6,"Woakes to Wade, no run, nips back in on middle, and the stoopy forward block",5,,,,,,,,"ENG vs AUS, 1st Test, The Ashes 2019"
Australia 2nd innings,60.5,"Woakes to Wade, no run, 83.7mph, length, small inswing after going past the stumps, but Wade's had a good measure of his off-stump, lining up his leave",5,,,,,,,,"ENG vs AUS, 1st Test, The Ashes 2019"
Australia 2nd innings,60.4,"Woakes to Wade, no run, 81mph, going across with the angle, which Wade is more than happy to leave",5,,,,,,,,"ENG vs AUS, 1st Test, The Ashes 2019"
Australia 2nd innings,60.3,"Woakes to Wade, no run, 80mph, a shuffling hop, settling behind in defence",5,,,,,,,,"ENG vs AUS, 1st Test, The Ashes 2019"
Australia 2nd innings,60.2,"Woakes to Wade, no run, middle-lined, good length, Wade gets across as he tucks it around",5,,,,,,,,"ENG vs AUS, 1st Test, The Ashes 2019"
Australia 2nd innings,60.1,"Woakes to Smith, 1 run, gentle, really, really gentle. Straying into the pads, and 98 to 99 is damn easy, tickling to fine leg",5,,,,,,,,"ENG vs AUS, 1st Test, The Ashes 2019"
Australia 2nd innings,59.6,"Moeen Ali to Smith, 1 run, flighted delivery just outside off stump, Smith drives it to mid-on",5,,,,,,,,"ENG vs AUS, 1st Test, The Ashes 2019"
Australia 2nd innings,59.5,"Moeen Ali to Smith, no run, flatter in trajectory, Smith defends off the back foot",5,,,,,,,,"ENG vs AUS, 1st Test, The Ashes 2019"
Australia 2nd innings,59.4,"Moeen Ali to Smith, no run, this is a hard drive but the man at cover dives and stops",5,,,,,,,,"ENG vs AUS, 1st Test, The Ashes 2019"
Australia 2nd innings,59.3,"Moeen Ali to Smith, no run, flighted delivery outside off stump, Smith drives hard and hits it back to the bowler",5,,,,,,,,"ENG vs AUS, 1st Test, The Ashes 2019"
Australia 2nd innings,59.2,"Moeen Ali to Smith, no run, oh this one jumps on Smith, who misses the defence and wears this high on the thigh pad",5,,,,,,,,"ENG vs AUS, 1st Test, The Ashes 2019"
Australia 2nd innings,59.1,"Moeen Ali to Smith, no run, spinning back in, Smith defends to short leg",5,,,,,,,,"ENG vs AUS, 1st Test, The Ashes 2019"
Australia 2nd innings,58.6,"Stokes to Wade, no run, fullish delivery on the off stump, Wade defends off the front foot",5,,,,,,,,"ENG vs AUS, 1st Test, The Ashes 2019"
Australia 2nd innings,58.5,"Stokes to Wade, no run, past the leg stump again",5,,,,,,,,"ENG vs AUS, 1st Test, The Ashes 2019"
Australia 2nd innings,58.4,"Stokes to Wade, no run, back over the wicket, short delivery on the stumps, Wade sways out",5,,,,,,,,"ENG vs AUS, 1st Test, The Ashes 2019"
Australia 2nd innings,58.3,"Stokes to Wade, FOUR, flicked away through mid-wicket, Stokes runs in hard and bowls a full ball on the stumps, Wade flicks with the angle from round the wicket and picks up four more",5,,,,,,,,"ENG vs AUS, 1st Test, The Ashes 2019"
Australia 2nd innings,58.2,"Stokes to Wade, no run, fired down the leg-side",5,,,,,,,,"ENG vs AUS, 1st Test, The Ashes 2019"
Australia 2nd innings,58.1,"Stokes to Wade, no run, short of length delivery outside off stump, Wade lets it go",5,,,,,,,,"ENG vs AUS, 1st Test, The Ashes 2019"
Australia 2nd innings,57.6,"Denly to Wade, 1 run, leg-side delivery, Wade glances it to fine leg",5,,,,,,,,"ENG vs AUS, 1st Test, The Ashes 2019"
Australia 2nd innings,57.5,"Denly to Wade, no run, well outside off stump, Wade shoulders arms",5,,,,,,,,"ENG vs AUS, 1st Test, The Ashes 2019"
Australia 2nd innings,57.4,"Denly to Wade, no run, defended off the back foot",5,,,,,,,,"ENG vs AUS, 1st Test, The Ashes 2019"
Australia 2nd innings,57.3,"Denly to Wade, no run, short and spinning down the leg-side, left alone",5,,,,,,,,"ENG vs AUS, 1st Test, The Ashes 2019"
Australia 2nd innings,57.2,"Denly to Wade, FOUR, lovely cover-drive, overpitched delivery outside off stump, Wade leans forward and middles the drive",5,,,,,,,,"ENG vs AUS, 1st Test, The Ashes 2019"
Australia 2nd innings,57.1,"Denly to Wade, no run, outside off stump, Wade covers the stumps and tries to pad it away",5,,,,,,,,"ENG vs AUS, 1st Test, The Ashes 2019"
Australia 2nd innings,56.6,"Stokes to Smith, no run, fullish delivery, driven towards mid-off",5,,,,,,,,"ENG vs AUS, 1st Test, The Ashes 2019"
Australia 2nd innings,56.5,"Stokes to Smith, 2 runs, tucked away through backward square leg for a couple of runs",5,,,,,,,,"ENG vs AUS, 1st Test, The Ashes 2019"
Australia 2nd innings,56.5,"Stokes to Smith, no ball, oversteps again as he delivers this good length delivery outside off stump, left alone",5,,,,,,,,"ENG vs AUS, 1st Test, The Ashes 2019"
Australia 2nd innings,56.4,"Stokes to Smith, no run, short delivery, Smith ducks under it",5,,,,,,,,"ENG vs AUS, 1st Test, The Ashes 2019"
Australia 2nd innings,56.3,"Stokes to Smith, no run, change of pace on the off stump, Smith defends",5,,,,,,,,"ENG vs AUS, 1st Test, The Ashes 2019"
Australia 2nd innings,56.2,"Stokes to Smith, no run, slower delivery outside off stump, defends into the off-side",5,,,,,,,,"ENG vs AUS, 1st Test, The Ashes 2019"
Australia 2nd innings,56.1,"Stokes to Smith, no run, fullish and outside off stump, Smith drives it towards cover, was the slower ball",5,,,,,,,,"ENG vs AUS, 1st Test, The Ashes 2019"
Australia 2nd innings,55.6,"Denly to Wade, 2 runs, top edged sweep shot, Wade plays dangerously and gets away with it as the ball doesn't carry to Moeen",5,,,,,,,,"ENG vs AUS, 1st Test, The Ashes 2019"
Australia 2nd innings,55.5,"Denly to Wade, no run, gets a good stride forward and pads this flighted delivery away",5,,,,,,,,"ENG vs AUS, 1st Test, The Ashes 2019"
Australia 2nd innings,55.4,"Denly to Wade, no run, oh he's trying to sweep from the rough, hit the arm and almost popped off, don't think it took the glove there",5,,,,,,,,"ENG vs AUS, 1st Test, The Ashes 2019"
Australia 2nd innings,55.3,"Denly to Wade, no run, leans forward and gently defends into the on-side",5,,,,,,,,"ENG vs AUS, 1st Test, The Ashes 2019"
Australia 2nd innings,55.2,"Denly to Wade, FOUR, that's a positive drive against the turn from Wade. Denly bowled this very full, Wade drilled that through cover where there is a big gap",5,,,,,,,,"ENG vs AUS, 1st Test, The Ashes 2019"
Australia 2nd innings,55.1,"Denly to Smith, 1 run, watches the ball spin away and flicks through mid-wicket",5,,,,,,,,"ENG vs AUS, 1st Test, The Ashes 2019"
Australia 2nd innings,54.6,"Stokes to Smith, 1 run, pulled through backward square leg",5,,,,,,,,"ENG vs AUS, 1st Test, The Ashes 2019"
Australia 2nd innings,54.5,"Stokes to Smith, no run, shortish delivery on the leg stump, Smith pulls to leg gully",5,,,,,,,,"ENG vs AUS, 1st Test, The Ashes 2019"
Australia 2nd innings,54.4,"Stokes to Smith, no run, short and down the leg-side, ignored",5,,,,,,,,"ENG vs AUS, 1st Test, The Ashes 2019"
Australia 2nd innings,54.3,"Stokes to Smith, no run, oh this time he leading-edges the attempted on-drive to this full ball, rolls to mid-off. Immediately puts his arms up and points in the direction wide of mid-on, where he wanted to send that for four",5,,,,,,,,"ENG vs AUS, 1st Test, The Ashes 2019"
Australia 2nd innings,54.2,"Stokes to Smith, FOUR, brilliant back foot punch. Leaning to the off-side, not bothering to move his feet, hands takeover and he plays a great shot through cover. Goes up towards the bowler and has a word",5,,,,,,,,"ENG vs AUS, 1st Test, The Ashes 2019"
Australia 2nd innings,54.1,"Stokes to Smith, no run, slower delivery outside off stump, Smith plays late and guides to backward point",5,,,,,,,,"ENG vs AUS, 1st Test, The Ashes 2019"
Australia 2nd innings,53.6,"Denly to Smith, 1 run, this time he flicks nicely to deep mid-wicket",5,,,,,,,,"ENG vs AUS, 1st Test, The Ashes 2019"
Australia 2nd innings,53.5,"Denly to Smith, no run, oh Smith wanted to play leg-side, the ball turned and took the outer half of the bat and rolled towards mid-off",5,,,,,,,,"ENG vs AUS, 1st Test, The Ashes 2019"
Australia 2nd innings,53.4,"Denly to Smith, no run, goes back and defends softly into the off-side",5,,,,,,,,"ENG vs AUS, 1st Test, The Ashes 2019"
Australia 2nd innings,53.3,"Denly to Smith, no run, on the leg stump, blocked to leg",5,,,,,,,,"ENG vs AUS, 1st Test, The Ashes 2019"
Australia 2nd innings,53.2,"Denly to Smith, no run, very full and on the stumps, Smith drives towards mid-off",5,,,,,,,,"ENG vs AUS, 1st Test, The Ashes 2019"
Australia 2nd innings,53.1,"Denly to Smith, no run, defended towards cover",5,,,,,,,,"ENG vs AUS, 1st Test, The Ashes 2019"
Australia 2nd innings,52.6,"Stokes to Head, out Caught by Bairstow!! There's the edge. This has come completely against the run of play. The umpires are checking for the no-ball. They are first checking if the back leg cut the return crease, and then the front foot. Stokes is fine on both counts. Head doesn't want to leave. That climb upstairs to the dressing room must take him an eternity, he tries to cover his face with his hand. First time England bowled some dots to Head after a while and he tries the cut shot and perishes. The slower delivery from Stokes, width was there, so Head tried to get some runs to break free. Got a thick edge and the keeper did very well to dive low and forward to grab the edge. Stokes is pumped. That high-five is so fierce. Hope he hasn't injured any of his team-mates. Head c Bairstow b Stokes 51(116) [4s-6]",4,,,,,,,,"ENG vs AUS, 1st Test, The Ashes 2019"
Australia 2nd innings,52.5,"Stokes to Head, no run, oh he tries the leg stump yorker and bowls well outside leg",4,,,,,,,,"ENG vs AUS, 1st Test, The Ashes 2019"
Australia 2nd innings,52.4,"Stokes to Head, no run, fullish delivery just outside off stump, Head defends towards point",4,,,,,,,,"ENG vs AUS, 1st Test, The Ashes 2019"
Australia 2nd innings,52.3,"Stokes to Head, no run, just outside off stump, so Head guides to backward point",4,,,,,,,,"ENG vs AUS, 1st Test, The Ashes 2019"
Australia 2nd innings,52.2,"Stokes to Head, no run, defended into the on-side",4,,,,,,,,"ENG vs AUS, 1st Test, The Ashes 2019"
Australia 2nd innings,52.1,"Stokes to Smith, 1 run, to short mid-wicket, Smith defends to the rigth of mid-wicket and sets off",4,,,,,,,,"ENG vs AUS, 1st Test, The Ashes 2019"
Australia 2nd innings,51.6,"Denly to Smith, 1 run, very full delivery, Smith flicks to deep square leg",4,,,,,,,,"ENG vs AUS, 1st Test, The Ashes 2019"
Australia 2nd innings,51.5,"Denly to Smith, no run, again gets it in the rough, Smith defends uppishly defends towards the bowler",4,,,,,,,,"ENG vs AUS, 1st Test, The Ashes 2019"
Australia 2nd innings,51.4,"Denly to Smith, no run, almost catches the rough, in fact lands on the rough, Smith manages to hand it off the back foot",4,,,,,,,,"ENG vs AUS, 1st Test, The Ashes 2019"
Australia 2nd innings,51.3,"Denly to Smith, no run, stays deep in the crease and defends this spinnig delivery off the back foot as it keeps slightly low",4,,,,,,,,"ENG vs AUS, 1st Test, The Ashes 2019"
Australia 2nd innings,51.2,"Denly to Smith, FOUR, this is another full toss, another whip, this time just wide of the man at mid-wicket, but there's no one in the deep",4,,,,,,,,"ENG vs AUS, 1st Test, The Ashes 2019"
Australia 2nd innings,51.1,"Denly to Smith, FOUR, full toss, that's a sin. Smith spots that early, gets a stride forward and flicks powerfully through the vacant spaces of the mid-wicket region",4,,,,,,,,"ENG vs AUS, 1st Test, The Ashes 2019"
Australia 2nd innings,50.6,"Stokes to Head, FOUR, this time Head cuts in the gap past Burns. Top shot, got on top of the bounce and hit this short of length delivery along the ground wide of backward point. Fifty for Head - his 6th in Tests, another vital innings under pressure",4,,,,,,,,"ENG vs AUS, 1st Test, The Ashes 2019"
Australia 2nd innings,50.5,"Stokes to Head, no run, short delivery just outside off stump, Head sways out",4,,,,,,,,"ENG vs AUS, 1st Test, The Ashes 2019"
Australia 2nd innings,50.4,"Stokes to Head, no run, cut away fiercely, but Burns moves quickly to his right and stops the ball",4,,,,,,,,"ENG vs AUS, 1st Test, The Ashes 2019"
Australia 2nd innings,50.3,"Stokes to Smith, 1 run, another slower delivery, Smith flicks it to square leg, throw goes to the bowler's end but is off target",4,,,,,,,,"ENG vs AUS, 1st Test, The Ashes 2019"
Australia 2nd innings,50.2,"Stokes to Smith, no run, fended off the back foot",4,,,,,,,,"ENG vs AUS, 1st Test, The Ashes 2019"
Australia 2nd innings,50.1,"Stokes to Smith, no run, change of pace, slower delivery just around the off stump, Smith waits and defends",4,,,,,,,,"ENG vs AUS, 1st Test, The Ashes 2019"
Australia 2nd innings,49.6,"Denly to Smith, 1 run, I mean this is really amazing. Everytime Denly tries to land one on the rough to Smith, the ball hits the good part of the pitch and behaves normally. Contrastingly, the ball lands only on the rough to Head. Maybe this is the sort of luck you are rewarded with when you are so determined on the job",4,,,,,,,,"ENG vs AUS, 1st Test, The Ashes 2019"
Australia 2nd innings,49.5,"Denly to Head, 1 run, the hard sweep along the ground to deep square leg",4,,,,,,,,"ENG vs AUS, 1st Test, The Ashes 2019"
Australia 2nd innings,49.4,"Denly to Head, no run, blocked this time",4,,,,,,,,"ENG vs AUS, 1st Test, The Ashes 2019"
Australia 2nd innings,49.3,"Denly to Head, no run, Head in all sorts of trouble with the rough outside off stump for Denly to work with. Bairstow misses a stumping too. Head tried to defend, played inside the line, missed, came out of the crease but the keeper wasn't sharp enough",4,,,,,,,,"ENG vs AUS, 1st Test, The Ashes 2019"
Australia 2nd innings,49.2,"Denly to Smith, 1 run, leans forward and flicks the flighted delivery along the ground to deep mid-wicket",4,,,,,,,,"ENG vs AUS, 1st Test, The Ashes 2019"
Australia 2nd innings,49.1,"Denly to Smith, no run, Smith goes deep in the crease to defend this flighted delivery into the on-side",4,,,,,,,,"ENG vs AUS, 1st Test, The Ashes 2019"
Australia 2nd innings,48.6,"Stokes to Head, no run, short delivery outside off stump, Head shoulders arms",4,,,,,,,,"ENG vs AUS, 1st Test, The Ashes 2019"
Australia 2nd innings,48.5,"Stokes to Smith, 1 run, oh this was almost flicked to the man at leg gully. Jason Roy dives full length to his right as Smith walks across and doesn't control the flick shot, and he escapes",4,,,,,,,,"ENG vs AUS, 1st Test, The Ashes 2019"
Australia 2nd innings,48.4,"Stokes to Smith, no run, short but down the leg-side",4,,,,,,,,"ENG vs AUS, 1st Test, The Ashes 2019"
Australia 2nd innings,48.3,"Stokes to Smith, FOUR, this is excellent batting. No movement in the air or off the pitch, Stokes tests Smith with a full delivery outside off stump, Smith reaches out and guides the ball through point",4,,,,,,,,"ENG vs AUS, 1st Test, The Ashes 2019"
Australia 2nd innings,48.2,"Stokes to Smith, FOUR, short of length delivery outside off stump, Smith guides it to third man",4,,,,,,,,"ENG vs AUS, 1st Test, The Ashes 2019"
Australia 2nd innings,48.1,"Stokes to Smith, no run, fullish delivery on the off stump, Smith defends",4,,,,,,,,"ENG vs AUS, 1st Test, The Ashes 2019"
Australia 2nd innings,48.1,"Stokes to Smith, no ball, Stokes oversteps as he delivers this short of length delivery, Smith defends",4,,,,,,,,"ENG vs AUS, 1st Test, The Ashes 2019"
Australia 2nd innings,47.6,"Denly to Head, no run, swept hard, but the ball hits the man at leg gully",4,,,,,,,,"ENG vs AUS, 1st Test, The Ashes 2019"
Australia 2nd innings,47.5,"Denly to Head, no run, covers the line and defends",4,,,,,,,,"ENG vs AUS, 1st Test, The Ashes 2019"
Australia 2nd innings,47.4,"Denly to Head, no run, Head wanted to sweep, but realised it was too full and changed his shot, knocked into the on-side",4,,,,,,,,"ENG vs AUS, 1st Test, The Ashes 2019"
Australia 2nd innings,47.3,"Denly to Head, no run, oh the ball beats Head's forward defence off the rough, the ball rolls into the off-side off the pad",4,,,,,,,,"ENG vs AUS, 1st Test, The Ashes 2019"
Australia 2nd innings,47.2,"Denly to Smith, leg byes, 1 run, oh turn off the rough, inside sneaks between legs. Smith went deep in the crease to flick, luckily he was away from the line of leg stump",4,,,,,,,,"ENG vs AUS, 1st Test, The Ashes 2019"
Australia 2nd innings,47.1,"Denly to Smith, no run, round the wicket, flighted delivery on the leg stump, Smith defends off the front foot",4,,,,,,,,"ENG vs AUS, 1st Test, The Ashes 2019"
Australia 2nd innings,46.6,"Stokes to Head, no run, Stokes forces a bat-pad gap, but he isn't lucky enough to sneak through the gate, inside-edged drive hits the pad and rolls into the off-side",4,,,,,,,,"ENG vs AUS, 1st Test, The Ashes 2019"
Australia 2nd innings,46.5,"Stokes to Head, no run, this is a very good full delivery, right on the off stump, every chance of getting a nick if it's moving big off the seam, Head though was solidly behind to block",4,,,,,,,,"ENG vs AUS, 1st Test, The Ashes 2019"
Australia 2nd innings,46.4,"Stokes to Head, no run, shortish delivery on the leg stump, Head defends off the back foot",4,,,,,,,,"ENG vs AUS, 1st Test, The Ashes 2019"
Australia 2nd innings,46.3,"Stokes to Head, 2 runs, the partnership between Head and Smith is now, Stokes kicks the turf in disappointment for bowling another one down the leg-side, tried the yorker, got the line wrong, Head glances to fine leg. 100 partnership comes up. The frustration adds for England",4,,,,,,,,"ENG vs AUS, 1st Test, The Ashes 2019"
Australia 2nd innings,46.2,"Stokes to Head, no run, sprayed just down the leg-side",4,,,,,,,,"ENG vs AUS, 1st Test, The Ashes 2019"
Australia 2nd innings,46.1,"Stokes to Head, no run, slower delivery on the off stump, Head defends into the off-side",4,,,,,,,,"ENG vs AUS, 1st Test, The Ashes 2019"
Australia 2nd innings,46.1,"Stokes to Head, wide, yikes, it's got to be a really wayward delivery to be called a wide in Tests, this one was acres outside leg stump",4,,,,,,,,"ENG vs AUS, 1st Test, The Ashes 2019"
Australia 2nd innings,45.6,"Denly to Head, byes, 1 run, spinning back in, Head misses the glance, the ball rolls into the on-side off the pad",4,,,,,,,,"ENG vs AUS, 1st Test, The Ashes 2019"
Australia 2nd innings,45.5,"Denly to Smith, 1 run, shortish and on the stumps, Smith flicks to mid-wicket",4,,,,,,,,"ENG vs AUS, 1st Test, The Ashes 2019"
Australia 2nd innings,45.4,"Denly to Smith, no run, covers the line and blocks",4,,,,,,,,"ENG vs AUS, 1st Test, The Ashes 2019"
