innings,Over,Commentary,active_partnership,reviews,Review_team,Review_batsman,Review_umpire,Review_outcome,Umpires_call,Partnership_broken,match
England 1st innings,19.4,"Siddle to Rory Burns, no run, sticks to his line and length outside off, the ball skids along the surface and the batsman lets the keeper do the rest",2,,,,,,,,"ENG vs AUS, 1st Test, The Ashes 2019"
England 1st innings,19.3,"Siddle to Rory Burns, no run, back of a length outside off, Rory Burns plays this with his bat angled towards gully",2,,,,,,,,"ENG vs AUS, 1st Test, The Ashes 2019"
England 1st innings,19.2,"Siddle to Rory Burns, no run, outside off, back of a length, Rory Burns doesn't mess with it",2,,,,,,,,"ENG vs AUS, 1st Test, The Ashes 2019"
England 1st innings,19.1,"Siddle to Rory Burns, 2 runs, goes full, does Siddle. Rory Burns waits for the ball to arrive and squeezes it past the man at gully for a couple of runs. English supporters are cheering in the stands as the fifty comes up for England",2,,,,,,,,"ENG vs AUS, 1st Test, The Ashes 2019"
England 1st innings,18.6,"Pattinson to Root, no run, outside off, slightly short ball, Root keeps his eyes on the ball as it settles into the keeper's mitts",2,,,,,,,,"ENG vs AUS, 1st Test, The Ashes 2019"
England 1st innings,18.5,"Pattinson to Root, no run, that's a good delivery by Pattinson. This one pitched around off and seamed away after hitting back of length, Root plays well inside the line as the keeper gathers it",2,,,,,,,,"ENG vs AUS, 1st Test, The Ashes 2019"
England 1st innings,18.4,"Pattinson to Rory Burns, 1 run, another quick run taken. Rory Burns clips this one towards square leg and calls for a single. Head is quick to collect the ball and get rid of it, but Root is even quicker to get across, also there wasn't a direct-hit",2,,,,,,,,"ENG vs AUS, 1st Test, The Ashes 2019"
England 1st innings,18.3,"Pattinson to Rory Burns, no run, this one was slanted away from the batsman outside off, short in length and seaming away too, Rory Burns doesn't bother to chase it",2,,,,,,,,"ENG vs AUS, 1st Test, The Ashes 2019"
England 1st innings,18.2,"Pattinson to Root, 1 run, 88.5mph, seaming into the batsman on a short length, Root taps it with soft hands in front of cover-point and sets off for a quick run, his partner obliges and sprints towards the keeper's end in a jiffy",2,,,,,,,,"ENG vs AUS, 1st Test, The Ashes 2019"
England 1st innings,18.1,"Pattinson to Root, no run, pitched up by Pattinson, Root comes on his front foot and flicks it to the man at mid-wicket",2,,,,,,,,"ENG vs AUS, 1st Test, The Ashes 2019"
England 1st innings,17.6,"Siddle to Rory Burns, no run, angled into the batsman from round the wicket, slightly full in length and Rory Burns leaves it",2,,,,,,,,"ENG vs AUS, 1st Test, The Ashes 2019"
England 1st innings,17.5,"Siddle to Rory Burns, no run, keeps this one in the channel outside off, it's a length delivery and Rory Burns decides to leave it alone",2,,,,,,,,"ENG vs AUS, 1st Test, The Ashes 2019"
England 1st innings,17.4,"Siddle to Rory Burns, no run, gets down on his knee and drives the fullish delivery to extra cover",2,,,,,,,,"ENG vs AUS, 1st Test, The Ashes 2019"
England 1st innings,17.3,"Siddle to Rory Burns, no run, back of a length around off, Rory Burns punches it towards extra cover off his back foot",2,,,,,,,,"ENG vs AUS, 1st Test, The Ashes 2019"
England 1st innings,17.2,"Siddle to Root, 1 run, goes back in his crease and glides it to backward point for a single",2,,,,,,,,"ENG vs AUS, 1st Test, The Ashes 2019"
England 1st innings,17.1,"Siddle to Root, no run, seaming into the batsman around off, slightly full delivery and it's been defended off his front foot",2,,,,,,,,"ENG vs AUS, 1st Test, The Ashes 2019"
England 1st innings,16.6,"Lyon to Rory Burns, no run, works the flighted delivery in front of the man at short mid",2,,,,,,,,"ENG vs AUS, 1st Test, The Ashes 2019"
England 1st innings,16.5,"Lyon to Rory Burns, no run, tosses this one up outside off, Rory Burns shoulders arm",2,,,,,,,,"ENG vs AUS, 1st Test, The Ashes 2019"
England 1st innings,16.4,"Lyon to Rory Burns, FOUR, that's hardly taken any time to race away to the fence. A quicker off-break by Lyon and Rory Burns gets an outside edge as he tries to defend it. Playing with soft hands was the key, hence the ball managed to evade the fielder at short third man easily",2,,,,,,,,"ENG vs AUS, 1st Test, The Ashes 2019"
England 1st innings,16.3,"Lyon to Rory Burns, no run, keeps his head steady and knocks it back to Lyon",2,,,,,,,,"ENG vs AUS, 1st Test, The Ashes 2019"
England 1st innings,16.2,"Lyon to Rory Burns, no run, quicker one now, sharp turn and it's been defended into the off side by Rory Burns",2,,,,,,,,"ENG vs AUS, 1st Test, The Ashes 2019"
England 1st innings,16.1,"Lyon to Rory Burns, no run, flighted delivery outside off, Rory Burns leaves the off-break for the keeper",2,,,,,,,,"ENG vs AUS, 1st Test, The Ashes 2019"
England 1st innings,15.6,"Siddle to Root, no run, teasing length delivery in the channel outside off, Root is watchful as he leaves it for the keeper. Could have been so tempted to attempt a drive, but he's curbed his instincts on that occasion",2,,,,,,,,"ENG vs AUS, 1st Test, The Ashes 2019"
England 1st innings,15.5,"Siddle to Root, no run, sticks to his length, tight line around the off-stump and it's been blocked solidly by Root",2,,,,,,,,"ENG vs AUS, 1st Test, The Ashes 2019"
England 1st innings,15.4,"Siddle to Root, no run, short of a length around off, it nips back and catches Root's inside edge as he attempts a back foot punch",2,,,,,,,,"ENG vs AUS, 1st Test, The Ashes 2019"
England 1st innings,15.3,"Siddle to Root, no run, back of a length around off, skiddy delivery and it's been eased in front of covers by Root",2,,,,,,,,"ENG vs AUS, 1st Test, The Ashes 2019"
England 1st innings,15.2,"Siddle to Root, no run, back of a length around middle and leg, Root nudges it into the leg side",2,,,,,,,,"ENG vs AUS, 1st Test, The Ashes 2019"
England 1st innings,15.1,"Siddle to Root, no run, pitched up by Siddle and it's been driven straight back to the bowler by Root",2,,,,,,,,"ENG vs AUS, 1st Test, The Ashes 2019"
England 1st innings,14.6,"Lyon to Root, 1 run, treks back in his crease and works the flatter delivery through square leg",2,,,,,,,,"ENG vs AUS, 1st Test, The Ashes 2019"
England 1st innings,14.5,"Lyon to Rory Burns, 1 run, clips this one through square leg and gets a single",2,,,,,,,,"ENG vs AUS, 1st Test, The Ashes 2019"
England 1st innings,14.4,"Lyon to Rory Burns, no run, tossed up delivery around middle and leg, Rory Burns drives it back to the bowler",2,,,,,,,,"ENG vs AUS, 1st Test, The Ashes 2019"
England 1st innings,14.3,"Lyon to Rory Burns, no run, sharp off-break outside off, keeps a touch low and the batsman gets beaten as he tries to defend it",2,,,,,,,,"ENG vs AUS, 1st Test, The Ashes 2019"
England 1st innings,14.2,"Lyon to Rory Burns, no run, quicker delivery by Lyon, this one keep straights around middle and leg, Rory Burns looks to flick it away and gets beaten, struck on the pads, it was sliding down the leg side though",2,,,,,,,,"ENG vs AUS, 1st Test, The Ashes 2019"
England 1st innings,14.1,"Lyon to Rory Burns, 2 runs, tossed up off-break by Lyon and it's been clipped through mid-wicket by Rory Burns, couple of runs taken",2,,,,,,,,"ENG vs AUS, 1st Test, The Ashes 2019"
England 1st innings,13.6,"Siddle to Root, no run, loud shout for LBW. Aleem Dar shakes his head slowly and moves away. The nip-backer from Siddle and Root is caught to the crease, beaten on the inside edge and struck well above the kneeroll. Height was an issue and the ball was also doing too much",2,,,,,,,,"ENG vs AUS, 1st Test, The Ashes 2019"
England 1st innings,13.5,"Siddle to Root, no run, shortens the length outside off, Root has a needless poke at that before withdrawing his bat. Can consider that as beaten",2,,,,,,,,"ENG vs AUS, 1st Test, The Ashes 2019"
England 1st innings,13.4,"Siddle to Root, no run, edge that does not carry. Fuller and probing away around the fourth stump channel, Root has to play at that and the outside edge does not have enough on it to carry to Khawaja at fourth slip",2,,,,,,,,"ENG vs AUS, 1st Test, The Ashes 2019"
England 1st innings,13.3,"Siddle to Root, no run, back of a length on off and stays a touch low, Root adjusts well to bunt it to mid-off",2,,,,,,,,"ENG vs AUS, 1st Test, The Ashes 2019"
England 1st innings,13.2,"Siddle to Rory Burns, 3 runs, tad overpitched from Siddle and Burns flows into the drive, straight past mid-off and it is a long chase for Wade, he just manages to get there and flick it in for Pattinson to tidy up",2,,,,,,,,"ENG vs AUS, 1st Test, The Ashes 2019"
England 1st innings,13.1,"Siddle to Rory Burns, no run, angled in from round the wicket, Burns is right behind the line to defend to mid-on",2,,,,,,,,"ENG vs AUS, 1st Test, The Ashes 2019"
England 1st innings,12.6,"Lyon to Rory Burns, 1 run, sliding on with the angle, Burns nudges it through the mid-wicket pocket",2,,,,,,,,"ENG vs AUS, 1st Test, The Ashes 2019"
England 1st innings,12.5,"Lyon to Rory Burns, no run, there is definite turn. Pitched on leg-stump and spun across, Burns brings his bat down at an angle and the outer edge rolls away to backward point. This is going to be interesting",2,,,,,,,,"ENG vs AUS, 1st Test, The Ashes 2019"
England 1st innings,12.4,"Lyon to Rory Burns, no run, drifts in and Burns comes down the track, yorks himself and squeezes it to short fine",2,,,,,,,,"ENG vs AUS, 1st Test, The Ashes 2019"
England 1st innings,12.3,"Lyon to Rory Burns, no run, slower and around off, Burns prods forward and blocks it down the wicket",2,,,,,,,,"ENG vs AUS, 1st Test, The Ashes 2019"
England 1st innings,12.2,"Lyon to Root, 1 run, that is poor from Head. He has let Root off the hook very easily. Flighted outside off, Root pushes it to cover and the fumble allows the batsmen to cross over. Lyon and rest of the Aussies are not happy with that",2,,,,,,,,"ENG vs AUS, 1st Test, The Ashes 2019"
England 1st innings,12.1,"Lyon to Root, no run, ohhh! Lyon, you beauty. He almost fooled the England captain first ball. Tossed it up outside off and spun back in a long way, Root did not expect it to spin that much and didn't offer a shot, it wasn't far from the off-stump. Lyon likes it as he goes uhhh",2,,,,,,,,"ENG vs AUS, 1st Test, The Ashes 2019"
England 1st innings,11.6,"Siddle to Rory Burns, no run, back of a length around off, Burns is right behind the line to defend to mid-on",2,,,,,,,,"ENG vs AUS, 1st Test, The Ashes 2019"
England 1st innings,11.5,"Siddle to Rory Burns, no run, oh! Siddle went up for half an appeal but aborted quickly. The ball cut back in from a length and almost went through Burns, if not for the inside edge he was caught right in front of the stumps",2,,,,,,,,"ENG vs AUS, 1st Test, The Ashes 2019"
England 1st innings,11.4,"Siddle to Rory Burns, no run, fuller than a good length, Burns is stoic in his forward block",2,,,,,,,,"ENG vs AUS, 1st Test, The Ashes 2019"
England 1st innings,11.3,"Siddle to Rory Burns, no run, on a length around off, Burns blocks with the head right on top of the ball",2,,,,,,,,"ENG vs AUS, 1st Test, The Ashes 2019"
England 1st innings,11.2,"Siddle to Rory Burns, no run, fuller and outside off, Burns presses forward and pushes it firmly to mid-off",2,,,,,,,,"ENG vs AUS, 1st Test, The Ashes 2019"
England 1st innings,11.1,"Siddle to Rory Burns, 2 runs, good length ball that opens up Burns, the ball angled in from round the wicket and straightens a bit, the ball squirts away off the outside edge past the fourth slip, two added",2,,,,,,,,"ENG vs AUS, 1st Test, The Ashes 2019"
England 1st innings,10.6,"Pat Cummins to Root, no run, full and angled in around off, Root inside halves the drive to mid-on",2,,,,,,,,"ENG vs AUS, 1st Test, The Ashes 2019"
England 1st innings,10.5,"Pat Cummins to Root, no run, back of a length outside off, Root cue-ends the dab to gully",2,,,,,,,,"ENG vs AUS, 1st Test, The Ashes 2019"
England 1st innings,10.4,"Pat Cummins to Rory Burns, 1 run, short of length around off, Burns drops it with soft hands into the off-side and sets off",2,,,,,,,,"ENG vs AUS, 1st Test, The Ashes 2019"
England 1st innings,10.3,"Pat Cummins to Rory Burns, leg byes, FOUR, oh! That was a sharp bouncer from Cummins. Burns spotted it late and just managed to duck, the ball brushed the helmet and flew over the 'keeper. There is not much Paine could have done there",2,,,,,,,,"ENG vs AUS, 1st Test, The Ashes 2019"
England 1st innings,10.2,"Pat Cummins to Rory Burns, no run, fuller than a good length ball, Burns prods forward and defends to mid-off",2,,,,,,,,"ENG vs AUS, 1st Test, The Ashes 2019"
England 1st innings,10.1,"Pat Cummins to Rory Burns, no run, 89.5 good length delivery just outside off, Burns presses forward and pokes at it away from the body, the ball holds its line and whizzes past the outside edge. Paine liked the line and length on this delivery",2,,,,,,,,"ENG vs AUS, 1st Test, The Ashes 2019"
England 1st innings,9.6,"Pattinson to Rory Burns, leg byes, 1 run, does not get the line right for the left hander, drifts the back of a length delivery on leg-stump and Burns fails to clip it away, the ball deflects off the pad backward of square leg",2,,,,,,,,"ENG vs AUS, 1st Test, The Ashes 2019"
England 1st innings,9.5,"Pattinson to Root, 1 run, back of a length just outside off, Root drops it into the off-side and sets off, good response from Burns as well. Looks like Root damaged his bat playing that defensive shot and has called for a replacement",2,,,,,,,,"ENG vs AUS, 1st Test, The Ashes 2019"
England 1st innings,9.4,"Pattinson to Root, no run, uhhh! Root almost popped one back to Pattinson. The bowler he was close. Full delivery close to off-stump, Root is on the move as he plays the drive and it is a bit uppish, just lands in front of Pattinson",2,,,,,,,,"ENG vs AUS, 1st Test, The Ashes 2019"
England 1st innings,9.3,"Pattinson to Root, no run, back of a length just outside off, Root covers his stumps and shoulders arms",2,,,,,,,,"ENG vs AUS, 1st Test, The Ashes 2019"
England 1st innings,9.2,"Pattinson to Root, 2 runs, now goes fuller with a nip-backer, Root wanted to drive it through cover but instead squirts a thick inside edge through square leg, he opens his account with a brace",2,,,,,,,,"ENG vs AUS, 1st Test, The Ashes 2019"
England 1st innings,9.1,"Pattinson to Root, no run, oh! The scrambled seam delivery that almost caught the outside edge of Root's willow. Short of length and straightening, Root hangs his bat out away from the body and is beaten on the outside edge. The ball thuds into Paine's mitts",2,,,,,,,,"ENG vs AUS, 1st Test, The Ashes 2019"
England 1st innings,8.6,"Pat Cummins to Rory Burns, no run, stifled appeal for LBW. Cummins knew it was too high. Slants the back of a length delivery into the left hander, Burns is late on the flick shot and he misses it, struck above the pad and on the thigh pad. Definitely going over",2,,,,,,,,"ENG vs AUS, 1st Test, The Ashes 2019"
England 1st innings,8.5,"Pat Cummins to Rory Burns, no run, beats the bat rightaway. Short of length delivery angled in, but it goes on to hold its line, Burns plays for the incoming angle and is beaten on the outside edge",2,,,,,,,,"ENG vs AUS, 1st Test, The Ashes 2019"
England 1st innings,8.4,"Pat Cummins to Rory Burns, no run, back of a length close to off, Burns with a closed bat face turns it to mid-wicket",2,,,,,,,,"ENG vs AUS, 1st Test, The Ashes 2019"
England 1st innings,8.3,"Pat Cummins to Rory Burns, no run, banged in halfway down and rises only up to chest high, Burns goes on his toes and drops it beside the pitch on the off-side",2,,,,,,,,"ENG vs AUS, 1st Test, The Ashes 2019"
England 1st innings,8.2,"Pat Cummins to Rory Burns, no run, back of a length on the hips, Burns tucks it straight to mid-wicket",2,,,,,,,,"ENG vs AUS, 1st Test, The Ashes 2019"
England 1st innings,8.1,"Pat Cummins to Rory Burns, no run, short of length around off, Burns stands tall and defends down the wicket",2,,,,,,,,"ENG vs AUS, 1st Test, The Ashes 2019"
England 1st innings,7.6,"Pattinson to Root, no run, wicket maiden! But he wastes this final delivery. Should have him put away actually but Root missed out. Sprayed down leg, Root can't meet with the glance/tickle",2,,,,,,,,"ENG vs AUS, 1st Test, The Ashes 2019"
England 1st innings,7.5,"Pattinson to Root, no run, back of a length outside off, Root thought about fishing but withdrew his bat inside the line at the last second. Pattinson has a few words for the England captain. He's certainly pumped up",2,,,,,,,,"ENG vs AUS, 1st Test, The Ashes 2019"
England 1st innings,7.4,"Pattinson to Root, no run, fuller and just outside off, Root drives it down the ground, Siddle moves across from mid-on and makes a tumbling stop",2,,,,,,,,"ENG vs AUS, 1st Test, The Ashes 2019"
England 1st innings,7.3,"Pattinson to Root, no run, good length ball outside off, Root lifts his bat and lets it go",2,,,,,,,,"ENG vs AUS, 1st Test, The Ashes 2019"
England 1st innings,7.2,"Pattinson to Roy, out Caught by Smith!! It was coming. It was on the way. And Pattinson finally has Roy caught in the cordon. He troubled him with full deliveries but this was not full. It was back of a length very close to off, wee bit of away nibble and Roy can't help himself, pokes at it and the outside edge just manages to carry to Smith at second slip. He stayed low and took it inches from the ground. Roy c Smith b Pattinson 10(22) [4s-2]",1,,,,,,,,"ENG vs AUS, 1st Test, The Ashes 2019"
England 1st innings,7.1,"Pattinson to Roy, no run, back of a length closer to off-stump, Roy just manages to lift his bat up in time",1,,,,,,,,"ENG vs AUS, 1st Test, The Ashes 2019"
England 1st innings,6.6,"Pat Cummins to Rory Burns, no run, on a length slanted outside off, Burns is happy to leave it on line",1,,,,,,,,"ENG vs AUS, 1st Test, The Ashes 2019"
England 1st innings,6.5,"Pat Cummins to Rory Burns, no run, similar kind of delivery to the previous one, Burns lifts his bat and lets it go",1,,,,,,,,"ENG vs AUS, 1st Test, The Ashes 2019"
England 1st innings,6.4,"Pat Cummins to Rory Burns, no run, angles the back of a length delivery across the left hander, Burns shoulders arms",1,,,,,,,,"ENG vs AUS, 1st Test, The Ashes 2019"
England 1st innings,6.3,"Pat Cummins to Rory Burns, no run, full and attacking off-stump, Burns closes the bat face a bit and drives to mid-on",1,,,,,,,,"ENG vs AUS, 1st Test, The Ashes 2019"
England 1st innings,6.2,"Pat Cummins to Rory Burns, no run, back of a length around off, Burns is right beside the line to defend",1,,,,,,,,"ENG vs AUS, 1st Test, The Ashes 2019"
England 1st innings,6.1,"Pat Cummins to Rory Burns, FOUR, and he immediately gifts a delivery on the batsman's pads, Burns puts it away effortlessly. He flicks it with his waiting going forward and places it square on the leg-side, no need to run for that",1,,,,,,,,"ENG vs AUS, 1st Test, The Ashes 2019"
England 1st innings,5.6,"Pattinson to Roy, no run, now bit of inward movement from a fullish length, Roy drives outside the line and the thickish inside edge rolls to mid-on. A good testing over from Pattinson, who is certainly found more movement than Cummins",1,,,,,,,,"ENG vs AUS, 1st Test, The Ashes 2019"
England 1st innings,5.5,"Pattinson to Roy, no run, back of a length nips in and Roy is caught in the crease, the ball beats the inside edge and hits him on the back thigh",1,,,,,,,,"ENG vs AUS, 1st Test, The Ashes 2019"
England 1st innings,5.4,"Pattinson to Roy, no run, edged and safe! Pattinson is troubling Roy and for now the batsman has managed to survive. Fuller and drawing the batsman forward, Roy cannot hold himself as he goes feeling for the ball, but loose hands help him out as the outside edge lands just in front of Smith at second slip",1,,,,,,,,"ENG vs AUS, 1st Test, The Ashes 2019"
England 1st innings,5.3,"Pattinson to Roy, no run, shortens the length outside off, Roy has nothing to do with it, left alone",1,,,,,,,,"ENG vs AUS, 1st Test, The Ashes 2019"
England 1st innings,5.2,"Pattinson to Roy, no run, good length ball decks in and Roy is hurried into bringing his bat, inside halves the block into the on-side",1,,,,,,,,"ENG vs AUS, 1st Test, The Ashes 2019"
England 1st innings,5.1,"Pattinson to Roy, no run, fullish delivery on the fourth stump line, Roy defends with the head on top of the ball",1,,,,,,,,"ENG vs AUS, 1st Test, The Ashes 2019"
England 1st innings,4.6,"Pat Cummins to Rory Burns, no run, back of a length angled in, Burns is right behind the line and turns it to mid-wicket",1,,,,,,,,"ENG vs AUS, 1st Test, The Ashes 2019"
England 1st innings,4.5,"Pat Cummins to Rory Burns, no run, pitched up around the fourth stump, Burns pushes it back firmly to Cummins",1,,,,,,,,"ENG vs AUS, 1st Test, The Ashes 2019"
England 1st innings,4.4,"Pat Cummins to Rory Burns, no run, short of length outside off, Burns lifts his bat and lets it go. Good carry through to Paine",1,,,,,,,,"ENG vs AUS, 1st Test, The Ashes 2019"
England 1st innings,4.3,"Pat Cummins to Rory Burns, no run, fuller and close to off, Burns prods forward and defends to mid-off",1,,,,,,,,"ENG vs AUS, 1st Test, The Ashes 2019"
England 1st innings,4.2,"Pat Cummins to Rory Burns, no run, dragged back length and immediately beats the outside edge. Short of length angled in and straightened, Burns plays for the incoming angle and is defeated on the outside edge",1,,,,,,,,"ENG vs AUS, 1st Test, The Ashes 2019"
England 1st innings,4.1,"Pat Cummins to Rory Burns, FOUR, lovely shot! Cummins is searching for the outside edge and overpitches this full delivery, Burns bends his back knee and opens the bat face to drive it behind square. The outfield has dried out and the ball races away",1,,,,,,,,"ENG vs AUS, 1st Test, The Ashes 2019"
England 1st innings,3.6,"Pattinson to Roy, no run, short of length on off, Roy is comfortable sitting back, he offers a straight bat in his defence",1,,,,,,,,"ENG vs AUS, 1st Test, The Ashes 2019"
England 1st innings,3.5,"Pattinson to Roy, no run, back of a length around off, Roy hops back and defends it in front of mid-off",1,,,,,,,,"ENG vs AUS, 1st Test, The Ashes 2019"
England 1st innings,3.4,"Pattinson to Roy, no run, good length ball that stays a touch low, Roy sees it all the way, adjusts with a crouched stance and blocks it back to Pattinson",1,,,,,,,,"ENG vs AUS, 1st Test, The Ashes 2019"
England 1st innings,3.3,"Pattinson to Roy, no run, shortens the length and moving away outside off, Roy thought about it for a second but withdrew his bat in the nick of time",1,,,,,,,,"ENG vs AUS, 1st Test, The Ashes 2019"
England 1st innings,3.2,"Pattinson to Roy, FOUR, edged and safe! That bisected third slip and gully perfectly. A fourth slip would have snaffled it up. Full and asking the batsman to drive, Roy does not need a second invitation as he goes hard and the outside edge flies through the slip cordon. Pattinson has his hands on the hip",1,,,,,,,,"ENG vs AUS, 1st Test, The Ashes 2019"
England 1st innings,3.1,"Pattinson to Roy, no run, fuller than a good length and outside off, Roy watches it sail past him",1,,,,,,,,"ENG vs AUS, 1st Test, The Ashes 2019"
England 1st innings,2.6,"Pat Cummins to Rory Burns, no run, back of a length outside off, Burns lifts his bat and lets it go",1,,,,,,,,"ENG vs AUS, 1st Test, The Ashes 2019"
England 1st innings,2.5,"Pat Cummins to Rory Burns, no run, fuller and around off, Burns with a half-cooked stride blocks it into the off-side",1,,,,,,,,"ENG vs AUS, 1st Test, The Ashes 2019"
England 1st innings,2.4,"Pat Cummins to Rory Burns, no run, full and outside off, Burns almost squeezes it out to squarish mid-off",1,,,,,,,,"ENG vs AUS, 1st Test, The Ashes 2019"
England 1st innings,2.3,"Pat Cummins to Rory Burns, no run, angled in from a fullish length, Burns closes the bat face and turns it to mid-wicket",1,,,,,,,,"ENG vs AUS, 1st Test, The Ashes 2019"
England 1st innings,2.2,"Pat Cummins to Rory Burns, no run, on a length and bit of outward movement outside off, Burns waves his bat and lets it through to Paine",1,,,,,,,,"ENG vs AUS, 1st Test, The Ashes 2019"
England 1st innings,2.1,"Pat Cummins to Rory Burns, no run, very full delivery outside off, Burns bends forward and pushes it to mid-off",1,,,,,,,,"ENG vs AUS, 1st Test, The Ashes 2019"
England 1st innings,1.6,"Pattinson to Roy, 2 runs, 89.7mph, and Roy has a streaky miss. Pattinson keeps it really full on off, sucks Roy into driving and ends up with a big fat inside edge into backward square leg. England survive, only just ..",1,,,,,,,,"ENG vs AUS, 1st Test, The Ashes 2019"
England 1st innings,1.5,"Pattinson to Roy, no run, 86.3mph, right behind this one, rolling his wrists on it then to turn it to leg",1,,,,,,,,"ENG vs AUS, 1st Test, The Ashes 2019"
England 1st innings,1.4,"Pattinson to Roy, no run, 88.1mph, jags in off the pitch, hurrying past the strange back-footed defence to smash into his tummy",1,,,,,,,,"ENG vs AUS, 1st Test, The Ashes 2019"
England 1st innings,1.3,"Pattinson to Roy, FOUR, 89mph, juicy wide overcook. Roy has enough time to lean in, wait on it and drill it on its head through the covers",1,,,,,,,,"ENG vs AUS, 1st Test, The Ashes 2019"
England 1st innings,1.2,"Pattinson to Rory Burns, 1 run, 87.1mph, middle-lined, but Burns walks across his stumps and inside-edges his defence through square leg",1,,,,,,,,"ENG vs AUS, 1st Test, The Ashes 2019"
England 1st innings,1.1,"Pattinson to Rory Burns, no run, 88.7mph, full, swinging away outside off. Easy leave",1,,,,,,,,"ENG vs AUS, 1st Test, The Ashes 2019"
England 1st innings,0.6,"Pat Cummins to Roy, no run, scoots low off a length, having Roy in a hurried crouch as he does his best to keep it out",1,,,,,,,,"ENG vs AUS, 1st Test, The Ashes 2019"
