innings,Over,Commentary,active_partnership,reviews,Review_team,Review_batsman,Review_umpire,Review_outcome,Umpires_call,Partnership_broken,match
England 1st innings,100.5,"Lyon to Bairstow, no run, slower off break on a good length outside off, Bairstow hangs back and defends late by allowing it to spin into him",6,,,,,,,,"ENG vs AUS, 1st Test, The Ashes 2019"
England 1st innings,100.4,"Lyon to Rory Burns, 1 run, drops it short and Burns cuts it away towards deep point",6,,,,,,,,"ENG vs AUS, 1st Test, The Ashes 2019"
England 1st innings,100.3,"Lyon to Rory Burns, no run, fuller and outside off, Burns leans forward and blocks it",6,,,,,,,,"ENG vs AUS, 1st Test, The Ashes 2019"
England 1st innings,100.2,"Lyon to Rory Burns, no run, sharp turn! Rips away after pitching with extra bounce, Burns is squared up totally as he tries to defend. There was a disturbance on the top surface of the track as well, encouraging signs for Lyon",6,,,,,,,,"ENG vs AUS, 1st Test, The Ashes 2019"
England 1st innings,100.1,"Lyon to Rory Burns, no run, starts with a floaty off break on middle and off, kept out with a front foot stride",6,,,,,,,,"ENG vs AUS, 1st Test, The Ashes 2019"
England 1st innings,99.6,"Siddle to Bairstow, no run, another good ball! This seams away late and Bairstow was almost about to play at it, bails out in the nick of time",6,,,,,,,,"ENG vs AUS, 1st Test, The Ashes 2019"
England 1st innings,99.5,"Siddle to Bairstow, no run, past the edge! Siddle has started really well. Once again probes around the off stump and gets this to hold its line with a bit of bounce. Bairstow pushes at it with no footwork at all",6,,,,,,,,"ENG vs AUS, 1st Test, The Ashes 2019"
England 1st innings,99.4,"Siddle to Bairstow, no run, fourth stump line from a good length, straightens a fraction as Bairstow defends it by playing late",6,,,,,,,,"ENG vs AUS, 1st Test, The Ashes 2019"
England 1st innings,99.3,"Siddle to Bairstow, no run, shortish and angling into Bairstow who gets an inside edge on the flick to short mid-wicket",6,,,,,,,,"ENG vs AUS, 1st Test, The Ashes 2019"
England 1st innings,99.2,"Siddle to Bairstow, no run, short of a good length and Bairstow stands tall to punch it, gets a thick bottom edge onto the pitch",6,,,,,,,,"ENG vs AUS, 1st Test, The Ashes 2019"
England 1st innings,99.1,"Siddle to Bairstow, no run, just past the stumps! Barely carries through to Paine. Siddle is on target with his first ball of the day, angles this into Bairstow from just outside off and there's no shot offered. A bit too close for comfort in the end for the batsman",6,,,,,,,,"ENG vs AUS, 1st Test, The Ashes 2019"
England 1st innings,98.6,"Pattinson to Bairstow, 1 run, angling into the pads and duly milked away with a flick to deep square leg",6,,,,,,,,"ENG vs AUS, 1st Test, The Ashes 2019"
England 1st innings,98.5,"Pattinson to Bairstow, no run, uppish again but doesn't carry to mid-wicket. Was shortish on leg stump and Bairstow went across for the back foot flick. Couldn't quite keep the shot down and was worried for a moment",6,,,,,,,,"ENG vs AUS, 1st Test, The Ashes 2019"
England 1st innings,98.4,"Pattinson to Bairstow, no run, edged but doesn't carry to second slip! This one held its line after the initial inward angle, trapping Bairstow who pushed tamely at it. Genuine edge but the pitch simply doesn't have any pace in it and the nick is well short of Smith in the cordon",6,,,,,,,,"ENG vs AUS, 1st Test, The Ashes 2019"
England 1st innings,98.3,"Pattinson to Bairstow, no run, fuller and closer to the off pole, defended nicely from the crease",6,,,,,,,,"ENG vs AUS, 1st Test, The Ashes 2019"
England 1st innings,98.2,"Pattinson to Bairstow, FOUR, England are into the lead! Loud cheers from the English supporters as they realise the significance of the moment. Was a half volley that's on the pads, Bairstow shuffled across to wrist it away in front of square on the leg-side",6,,,,,,,,"ENG vs AUS, 1st Test, The Ashes 2019"
England 1st innings,98.1,"Pattinson to Bairstow, no run, deflects off something through to Paine who is excited a bit, as is Pattinson but nothing from the umpire. Came off the forearm. Bairstow was ducking at this bouncer that didn't rise as much as he'd thought, taking his eyes off early also didn't help",6,,,,,,,,"ENG vs AUS, 1st Test, The Ashes 2019"
England 1st innings,97.6,"Pat Cummins to Bairstow, 1 run, tap-and-run from Bairstow who charges across to get off the mark. After the debacle against Ireland, this will give him relief. Kept low slightly from a shorter length as Bairstow got his bat down in time to stab this to cover",6,,,,,,,,"ENG vs AUS, 1st Test, The Ashes 2019"
England 1st innings,97.5,"Pat Cummins to Bairstow, no run, pinged on the pad but it's quite high. Bairstow was shuffling across to work across the line but missed it totally be struck near the thigh area",6,,,,,,,,"ENG vs AUS, 1st Test, The Ashes 2019"
England 1st innings,97.4,"Pat Cummins to Bairstow, no run, fuller and challenging the off pole with an in-angler, Bairstow gets forward and defends to mid-off",6,,,,,,,,"ENG vs AUS, 1st Test, The Ashes 2019"
England 1st innings,97.3,"Pat Cummins to Bairstow, no run, shorter again and angling into Bairstow who defends from the crease",6,,,,,,,,"ENG vs AUS, 1st Test, The Ashes 2019"
England 1st innings,97.2,"Pat Cummins to Bairstow, no run, shortish and angling in from around off, Bairstow defends it from the crease",6,,,,,,,,"ENG vs AUS, 1st Test, The Ashes 2019"
England 1st innings,97.1,"Pat Cummins to Stokes, out Caught by Paine!! This is a wicket out of nowhere! Everyone seemed taken aback by the event, so much so that it didn't even seem like a wicket at first. A loose shot from Stokes as he chased a wider length ball that was angling across him. Both the southpaws had missed these quite a lot of times yesterday and even today but there is a faint nick on this one as Paine pouches it. The Aussies were starting to go flat in their body language, so this is a timely wicket indeed. Stokes curses himself on his way back. Stokes c Paine b Pat Cummins 50(96) [4s-8]",5,,,,,,,,"ENG vs AUS, 1st Test, The Ashes 2019"
England 1st innings,96.6,"Pattinson to Rory Burns, no run, short of a length outside off, Burns stays back and defends it to point",5,,,,,,,,"ENG vs AUS, 1st Test, The Ashes 2019"
England 1st innings,96.5,"Pattinson to Rory Burns, no run, wide of the crease and angles in from outside off, Burns defends firmly to point",5,,,,,,,,"ENG vs AUS, 1st Test, The Ashes 2019"
England 1st innings,96.4,"Pattinson to Stokes, 1 run, 18th Test fifty for Stokes! Continues his impressive home summer, first had a fine World Cup topped with that iconic MoM performance in the final and now has chipped in with a vital fifty. Gets to the milestone with a checked-drive to mid-off",5,,,,,,,,"ENG vs AUS, 1st Test, The Ashes 2019"
England 1st innings,96.3,"Pattinson to Rory Burns, 1 run, walks across to this away-angler and steers it down to third man",5,,,,,,,,"ENG vs AUS, 1st Test, The Ashes 2019"
England 1st innings,96.2,"Pattinson to Rory Burns, no run, short of a length angling across Burns defends from the crease to point",5,,,,,,,,"ENG vs AUS, 1st Test, The Ashes 2019"
England 1st innings,96.1,"Pattinson to Rory Burns, no run, fourth stump line from a good length, Burns is water-tight in his defence",5,,,,,,,,"ENG vs AUS, 1st Test, The Ashes 2019"
England 1st innings,95.6,"Pat Cummins to Stokes, no run, angling across from around off stump, Stokes blocks firmly from the crease",5,,,,,,,,"ENG vs AUS, 1st Test, The Ashes 2019"
England 1st innings,95.5,"Pat Cummins to Stokes, FOUR, squared up but through the gap! Another edge that sneaks through. Stokes was walking down the track to this one and opened the bat face with soft hands. As a result, the edge didn't go in the air and eventually, it split second slip and gully",5,,,,,,,,"ENG vs AUS, 1st Test, The Ashes 2019"
England 1st innings,95.4,"Pat Cummins to Stokes, no run, floaty fuller ball outside off, Stokes shuffles on the front foot and defends",5,,,,,,,,"ENG vs AUS, 1st Test, The Ashes 2019"
England 1st innings,95.3,"Pat Cummins to Stokes, no run, back of a length and going across Stokes who stands tall to punch this towards point",5,,,,,,,,"ENG vs AUS, 1st Test, The Ashes 2019"
England 1st innings,95.2,"Pat Cummins to Rory Burns, 1 run, straightish line and slightly shorter, worked softly towards the gap at square leg",5,,,,,,,,"ENG vs AUS, 1st Test, The Ashes 2019"
England 1st innings,95.1,"Pat Cummins to Rory Burns, no run, middle and leg line, on a good length and Burns moves across to tap this to mid-wicket",5,,,,,,,,"ENG vs AUS, 1st Test, The Ashes 2019"
England 1st innings,94.6,"Pattinson to Stokes, no run, wider lines, from a good length and Stokes opens the bat face. Finds gully on the bounce",5,,,,,,,,"ENG vs AUS, 1st Test, The Ashes 2019"
England 1st innings,94.5,"Pattinson to Stokes, no run, shortish and keeps a touch low as Stokes stabs it off the back foot to cover",5,,,,,,,,"ENG vs AUS, 1st Test, The Ashes 2019"
England 1st innings,94.4,"Pattinson to Stokes, no run, this one keeps coming in with the angle from a good length, Stokes trusts the track and lets it pass",5,,,,,,,,"ENG vs AUS, 1st Test, The Ashes 2019"
England 1st innings,94.3,"Pattinson to Stokes, no run, pitched up just outside off, slanting into Stokes who defends solidly this time",5,,,,,,,,"ENG vs AUS, 1st Test, The Ashes 2019"
England 1st innings,94.2,"Pattinson to Stokes, no run, beaten this time! Frustration for Pattinson who has already beaten the edge plenty of times without much to show for. This was again full but slightly wider, inviting the drive from Stokes and he went hard at it without moving his feet at all. A stare from Patto but I don't think that will help him get a wicket",5,,,,,,,,"ENG vs AUS, 1st Test, The Ashes 2019"
England 1st innings,94.1,"Pattinson to Stokes, FOUR, glorious! ""Stokes at his best!"" gushes Nasser Hussain on air. Full and angling in from around off, he just gets his front leg out of the way and punches the drive with a straight bat. Beats mid-on and it races away",5,,,,,,,,"ENG vs AUS, 1st Test, The Ashes 2019"
England 1st innings,93.6,"Pat Cummins to Rory Burns, no run, shorter this time, not a bouncer as such but Burns arches his back to evade it",5,,,,,,,,"ENG vs AUS, 1st Test, The Ashes 2019"
England 1st innings,93.5,"Pat Cummins to Rory Burns, no run, beaten! Add that to the numerous number of plays and misses from Burns. The crucial aspect is that he has managed to erase the previous ball and play the next one positively. This squared him up a bit from a good length, extra bounce and angled across Burns who pushed inside the line",5,,,,,,,,"ENG vs AUS, 1st Test, The Ashes 2019"
England 1st innings,93.4,"Pat Cummins to Rory Burns, no run, wider lines outside off, angles further away as Burns lets it pass",5,,,,,,,,"ENG vs AUS, 1st Test, The Ashes 2019"
England 1st innings,93.3,"Pat Cummins to Rory Burns, no run, banged in short at 85.1mph, Burns has enough time to duck under it due to the slow nature of the track",5,,,,,,,,"ENG vs AUS, 1st Test, The Ashes 2019"
England 1st innings,93.2,"Pat Cummins to Rory Burns, no run, goes fuller and angling across Burns who moves forward for a confident push towards mid-off who is placed straighter",5,,,,,,,,"ENG vs AUS, 1st Test, The Ashes 2019"
England 1st innings,93.1,"Pat Cummins to Rory Burns, no run, fuller and just outside off, Burns leans forward and defends softly to cover",5,,,,,,,,"ENG vs AUS, 1st Test, The Ashes 2019"
England 1st innings,92.6,"Pattinson to Stokes, no run, huge appeal for caught behind! Umpire Joel Wilson is unmoved and rightly so, there was a noise but that was of bat hitting the ground. This was very full and just outside off, Stokes couldn't get his bat on it in time and in the process, dug the turf a bit and that created the sound. The Aussies knew it too I guess as they quietly walked away once the appeal was denied",5,,,,,,,,"ENG vs AUS, 1st Test, The Ashes 2019"
England 1st innings,92.5,"Pattinson to Stokes, no run, back of a length with a hint of width, Stokes hangs back and punches to cover",5,,,,,,,,"ENG vs AUS, 1st Test, The Ashes 2019"
England 1st innings,92.4,"Pattinson to Stokes, no run, fuller and just outside off, Stokes moves across a bit and wrists this to mid-on",5,,,,,,,,"ENG vs AUS, 1st Test, The Ashes 2019"
England 1st innings,92.3,"Pattinson to Stokes, 2 runs, dug in short but not that high and the slowness of the track further aids Stokes to stand up tall on the pull. Placed well to the right of deep square leg who comes around",5,,,,,,,,"ENG vs AUS, 1st Test, The Ashes 2019"
England 1st innings,92.2,"Pattinson to Stokes, no run, fuller and angling across Stokes who drives smoothly to mid-off who fumbles a bit but no harm done",5,,,,,,,,"ENG vs AUS, 1st Test, The Ashes 2019"
England 1st innings,92.1,"Pattinson to Stokes, no run, middle and off line, Stokes gets across on the back foot and defends",5,,,,,,,,"ENG vs AUS, 1st Test, The Ashes 2019"
England 1st innings,91.6,"Pat Cummins to Rory Burns, no run, fullish and outside off, Burns defends off the front foot to mid-off",5,,,,,,,,"ENG vs AUS, 1st Test, The Ashes 2019"
England 1st innings,91.5,"Pat Cummins to Rory Burns, no run, shortish of a length outside off, a bit too wide to make Burns play",5,,,,,,,,"ENG vs AUS, 1st Test, The Ashes 2019"
England 1st innings,91.4,"Pat Cummins to Rory Burns, no run, pitched up closer to the off stump, Burns shuffles across and defends back towards Cummins",5,,,,,,,,"ENG vs AUS, 1st Test, The Ashes 2019"
England 1st innings,91.3,"Pat Cummins to Stokes, 1 run, fuller once more and Stokes leans into the drive nicely, struck well but extra cover dives to get a hand on it. Parries this towards the left of mid-off who then gets around",5,,,,,,,,"ENG vs AUS, 1st Test, The Ashes 2019"
England 1st innings,91.2,"Pat Cummins to Stokes, no run, slightly fuller this time, challenging line around the fourth stump channel, left alone as Paine collects it near his chest",5,,,,,,,,"ENG vs AUS, 1st Test, The Ashes 2019"
England 1st innings,91.1,"Pat Cummins to Stokes, no run, short of a good length around off stump, 84.4mph, comfortably blocked off the back foot",5,,,,,,,,"ENG vs AUS, 1st Test, The Ashes 2019"
England 1st innings,90.6,"Pattinson to Rory Burns, no run, straightish line this time, on a good length and Burns shuffles a bit to defend",5,,,,,,,,"ENG vs AUS, 1st Test, The Ashes 2019"
England 1st innings,90.5,"Pattinson to Rory Burns, no run, beats the edge! Happened so many times for Burns yesterday and here's another one. No feet as he tentatively pokes at this away-seamer",5,,,,,,,,"ENG vs AUS, 1st Test, The Ashes 2019"
England 1st innings,90.4,"Pattinson to Stokes, byes, 1 run, what's happened here? Wow! This pitched just outside off and just seamed corners, straight to first slip where Warner can't gather cleanly. Did that hit a crack? Don't think so. Bizarre! Encouraging signs for Pattinson nevertheless and the batsmen scamper",5,,,,,,,,"ENG vs AUS, 1st Test, The Ashes 2019"
England 1st innings,90.3,"Pattinson to Stokes, no run, a near play and a miss! Slightly loose from Stokes as he goes chasing at this away-angler that also seams just a fraction further. He manages to bail out just in time but it wasn't convincing",5,,,,,,,,"ENG vs AUS, 1st Test, The Ashes 2019"
England 1st innings,90.2,"Pattinson to Stokes, no run, fractionally short of a good length, angling across Stokes who gets behind the line nicely and defends solidly once more",5,,,,,,,,"ENG vs AUS, 1st Test, The Ashes 2019"
England 1st innings,90.1,"Pattinson to Stokes, no run, pitched up around off stump, Stokes gets a touch forward and blocks firmly",5,,,,,,,,"ENG vs AUS, 1st Test, The Ashes 2019"
England 1st innings,89.6,"Lyon to Rory Burns, no run, kept out with a jammed defence. Too full, just as easy. That'll do for today ..",5,,,,,,,,"ENG vs AUS, 1st Test, The Ashes 2019"
England 1st innings,89.5,"Lyon to Stokes, 1 run .. and Stokes's done for the day, tucking it away off his body into mid-wicket",5,,,,,,,,"ENG vs AUS, 1st Test, The Ashes 2019"
England 1st innings,89.4,"Lyon to Stokes, no run, stretching in front now, head sniffing in the smother",5,,,,,,,,"ENG vs AUS, 1st Test, The Ashes 2019"
England 1st innings,89.3,"Lyon to Stokes, no run, the shuffling defence to play for the spin, but Lyon has fired this one in with the arm. Hence - a thick inside edge, behind short leg",5,,,,,,,,"ENG vs AUS, 1st Test, The Ashes 2019"
England 1st innings,89.2,"Lyon to Stokes, no run, shuffles, settling behind this in defence",5,,,,,,,,"ENG vs AUS, 1st Test, The Ashes 2019"
England 1st innings,89.1,"Lyon to Stokes, no run, leading-edge, but a harmless one that goes to ground really quickly",5,,,,,,,,"ENG vs AUS, 1st Test, The Ashes 2019"
England 1st innings,88.6,"Siddle to Rory Burns, no run, pushed out, squeezing it off the outside half to point",5,,,,,,,,"ENG vs AUS, 1st Test, The Ashes 2019"
England 1st innings,88.5,"Siddle to Rory Burns, no run, 81.6mph, fuller, angling across. Burns clearly woudn't be having a problem with these, leaving it once again on the line",5,,,,,,,,"ENG vs AUS, 1st Test, The Ashes 2019"
England 1st innings,88.4,"Siddle to Rory Burns, no run, too wide. And the over the wicket angle isn't helping Siddle's cause either. Easy leaves",5,,,,,,,,"ENG vs AUS, 1st Test, The Ashes 2019"
England 1st innings,88.3,"Siddle to Stokes, 1 run, tummy-lined, Stokes neatly walks into it again and glances it behind square. And he wants the second, but no, Burns' been there all day",5,,,,,,,,"ENG vs AUS, 1st Test, The Ashes 2019"
England 1st innings,88.2,"Siddle to Stokes, no run, tight angle going across off. Stokes lines it up well, leaving",5,,,,,,,,"ENG vs AUS, 1st Test, The Ashes 2019"
England 1st innings,88.1,"Siddle to Stokes, no run, 78.4mph, good length on middle. Stokes walks across, head-on-ball stuff",5,,,,,,,,"ENG vs AUS, 1st Test, The Ashes 2019"
England 1st innings,87.6,"Lyon to Rory Burns, no run, too full, and too middle a line. Burns leans on top of this",5,,,,,,,,"ENG vs AUS, 1st Test, The Ashes 2019"
England 1st innings,87.5,"Lyon to Rory Burns, no run, another bamboozling beat. Lyon finally gets it right, drawing Burns on the defence, only to drift away further and rip past",5,,,,,,,,"ENG vs AUS, 1st Test, The Ashes 2019"
England 1st innings,87.4,"Lyon to Rory Burns, no run, more behind, but for a full-blooded block",5,,,,,,,,"ENG vs AUS, 1st Test, The Ashes 2019"
England 1st innings,87.3,"Lyon to Rory Burns, 2 runs, makes his room, and Lyon once again goes just too short. Slapped in the end, and an empty point helps too",5,,,,,,,,"ENG vs AUS, 1st Test, The Ashes 2019"
England 1st innings,87.2,"Lyon to Rory Burns, no run, forward again, defending off the inside half",5,,,,,,,,"ENG vs AUS, 1st Test, The Ashes 2019"
England 1st innings,87.1,"Lyon to Rory Burns, no run, tosses it outside off, with Burns reaching out away from his body in the cover-push",5,,,,,,,,"ENG vs AUS, 1st Test, The Ashes 2019"
England 1st innings,86.6,"Siddle to Stokes, FOUR, an almighty walk across his stumps, making this seemingly disarming middle-stump line into a ghastly on on his pads and glances it ever so fine",5,,,,,,,,"ENG vs AUS, 1st Test, The Ashes 2019"
England 1st innings,86.5,"Siddle to Stokes, no run, 83.3mph, a pushed forward drive, through the line, to cover",5,,,,,,,,"ENG vs AUS, 1st Test, The Ashes 2019"
England 1st innings,86.4,"Siddle to Stokes, no run, 80.9mph, stays behind, opening up his defence just a touch as he taps it to cover",5,,,,,,,,"ENG vs AUS, 1st Test, The Ashes 2019"
England 1st innings,86.3,"Siddle to Stokes, no run, 79.5mph, cuts in big again, nearly cutting through Stokes' defence as it takes a thick inside edge onto his pad",5,,,,,,,,"ENG vs AUS, 1st Test, The Ashes 2019"
England 1st innings,86.2,"Siddle to Stokes, no run, a tad shorter. Stokes swivels in his pull, swatting it out to mid-wicket",5,,,,,,,,"ENG vs AUS, 1st Test, The Ashes 2019"
England 1st innings,86.1,"Siddle to Stokes, no run, 82.2mph, good length, sharply cutting in off the pitch. Stokes though has a measure of things going around, he knows it's bouncing enough to leave",5,,,,,,,,"ENG vs AUS, 1st Test, The Ashes 2019"
England 1st innings,85.6,"Lyon to Rory Burns, no run, absolute brute of a peach. Lyon hits the perfect length, getting it to grip and then rip past the outside on Burns' defence",5,,,,,,,,"ENG vs AUS, 1st Test, The Ashes 2019"
England 1st innings,85.5,"Lyon to Rory Burns, no run, draws him forward with the drift outside off, poked out to point",5,,,,,,,,"ENG vs AUS, 1st Test, The Ashes 2019"
England 1st innings,85.4,"Lyon to Rory Burns, no run, now the spit up. Splices the punchy defence to point",5,,,,,,,,"ENG vs AUS, 1st Test, The Ashes 2019"
England 1st innings,85.3,"Lyon to Rory Burns, FOUR, under-chop. Burns is milking every bit of his luck, and when it's not his outside edge, it's the inside one .. with him trying to cut this skidder, only to somehow jab his bat down and run it through the keeper's legs",5,,,,,,,,"ENG vs AUS, 1st Test, The Ashes 2019"
England 1st innings,85.2,"Lyon to Stokes, 1 run, leans backwards, opening his bat face as he steers it away behind point",5,,,,,,,,"ENG vs AUS, 1st Test, The Ashes 2019"
England 1st innings,85.1,"Lyon to Stokes, no run, quite short, spinning wide, slapped away to a deepish extra cover",5,,,,,,,,"ENG vs AUS, 1st Test, The Ashes 2019"
England 1st innings,84.6,"Pattinson to Rory Burns, no run, 86.8mph, a bigger shuffle, getting low as he digs out his punch back",5,,,,,,,,"ENG vs AUS, 1st Test, The Ashes 2019"
England 1st innings,84.5,"Pattinson to Rory Burns, no run, 85.7mph, wobbles outside off. Burns has a lazy waft, just not getting close to the line of it to connect",5,,,,,,,,"ENG vs AUS, 1st Test, The Ashes 2019"
England 1st innings,84.4,"Pattinson to Rory Burns, 2 runs, 84.1mph, shuffles, nudges and runs it through square leg. The fielder throw in his throw first nearly cleans up the umpire, and then nearly cleans up Stokes",5,,,,,,,,"ENG vs AUS, 1st Test, The Ashes 2019"
England 1st innings,84.3,"Pattinson to Rory Burns, no run, 89mph, lines up beside, getting his high batted block up in time",5,,,,,,,,"ENG vs AUS, 1st Test, The Ashes 2019"
England 1st innings,84.2,"Pattinson to Rory Burns, no run, well left. A bit of seam movement back in off the pitch, flies over off",5,,,,,,,,"ENG vs AUS, 1st Test, The Ashes 2019"
England 1st innings,84.2,"Pattinson to Rory Burns, wide, 82.7mph, whizzes around the shoulder with Pattinson banging it in. But for some reason, the umpire reckons its over-head",5,,,,,,,,"ENG vs AUS, 1st Test, The Ashes 2019"
England 1st innings,84.1,"Pattinson to Stokes, 1 run, 83.2mph, stays behind with a small poke. And the outside of the poke will run down to third man",5,,,,,,,,"ENG vs AUS, 1st Test, The Ashes 2019"
England 1st innings,83.6,"Pat Cummins to Stokes, 1 run, arches away to carve it through the covers",5,,,,,,,,"ENG vs AUS, 1st Test, The Ashes 2019"
England 1st innings,83.5,"Pat Cummins to Stokes, FOUR, 84.6mph, too full. Stokes has a delightful one-kneed punch off a bat face just as full as the length, drilling it through mid-off",5,,,,,,,,"ENG vs AUS, 1st Test, The Ashes 2019"
England 1st innings,83.4,"Pat Cummins to Stokes, 2 runs, stays his ground now, lets the width get big and cuts it away through point",5,,,,,,,,"ENG vs AUS, 1st Test, The Ashes 2019"
England 1st innings,83.3,"Pat Cummins to Stokes, no run, oh completely beaten. Stokes has an aimless walk down the track in looking to negate the movement, but Cummins' still found enough, getting it to zip away and whizz past the awkward defence",5,,,,,,,,"ENG vs AUS, 1st Test, The Ashes 2019"
England 1st innings,83.2,"Pat Cummins to Stokes, no run, 86.4mph, tightens up on off, which Stokes' defence ricochets onto his pad off the inside edge",5,,,,,,,,"ENG vs AUS, 1st Test, The Ashes 2019"
England 1st innings,83.1,"Pat Cummins to Stokes, no run, good length, going across, quietly left alone",5,,,,,,,,"ENG vs AUS, 1st Test, The Ashes 2019"
England 1st innings,82.6,"Pattinson to Rory Burns, no run, some in-nip, and Pattinson has once again gone back to wasting them down leg",5,,,,,,,,"ENG vs AUS, 1st Test, The Ashes 2019"
England 1st innings,82.5,"Pattinson to Rory Burns, no run, 83.8mph, dies through to the keeper, with Pattinson wasting this on the other side of the wicket",5,,,,,,,,"ENG vs AUS, 1st Test, The Ashes 2019"
England 1st innings,82.4,"Pattinson to Rory Burns, no run, finds some swing, but wastes all of it down leg",5,,,,,,,,"ENG vs AUS, 1st Test, The Ashes 2019"
England 1st innings,82.3,"Pattinson to Rory Burns, no run, half a flirt. Back of a good length, going across and Burns thinks of a poke, before quickly withdrawing back in",5,,,,,,,,"ENG vs AUS, 1st Test, The Ashes 2019"
England 1st innings,82.2,"Pattinson to Rory Burns, no run, big LBW ask -- And the Aussies ain't trusting these umpires any longer. They go up when it isn't given .. and it's pitching comfortably down leg. Ah, redemption, ump Wilson! Burns is trapped in the crease, but this over the wicket angle is always going to be dodgy",5,"Over 82.2: Review by Australia (Bowling), Umpire - JS Wilson, Batsman - RJ Burns (Struck down)",Australia (Bowling),RJ Burns,JS Wilson,Struck down,False,False,"ENG vs AUS, 1st Test, The Ashes 2019"
England 1st innings,82.1,"Pattinson to Stokes, 1 run, strays into the legs, tucked away softly behind square",5,,,,,,,,"ENG vs AUS, 1st Test, The Ashes 2019"
England 1st innings,81.6,"Pat Cummins to Rory Burns, no run, middle-lined, good length, plonks forward, inside the line and knocks it to mid-on",5,,,,,,,,"ENG vs AUS, 1st Test, The Ashes 2019"
